"作为领导，应该保持虚心。";"zuòwéi lǐngdǎo, yīnggāi bǎochí xūxīn.";"As a leader, one should remain humble.";"作为 (conduct; zuòwéi; hsk5)";"one's conduct/deed/activity/accomplishment/achievement/to act as/as (in the capacity of)/qua/to view as/to look upon (sth as)/to take sth to be";"领导 (lead; lǐngdǎo; hsk5)";"lead/leading/to lead/leadership/leader/CL:位[wèi],个[gè]";"应该 (should; yīnggāi; hsk3)";"ought to/should/must";"保持 (maintain; bǎochí; hsk5)";"to keep/to maintain/to hold/to preserve";"虚心 (humble; xūxīn; hsk5)";"open-minded/humble"
"他用钻打了一个洞。";"tāyòng zuān dǎ le yīgè dòng.";"He drilled a hole with an auger.";"他用 (tāyòng; non-hsk)";"other use/other purpose";"钻 (drill; zuān||zuàn; non-hsk)";"to drill; to bore; to get into; to make one's way into; to enter (a hole); to thread one's way through; to study intensively; to dig into; to curry favor for personal gain||an auger; diamond";"打 (beat; dá||dǎ; non-hsk)";"dozen (loanword)||to beat; to strike; to hit; to break; to type; to mix up; to build; to fight; to fetch; to make; to tie up; to issue; to shoot; to calculate; to play (a game); since; from";"了 (finish; le||liǎo||liǎo; hsk1)";"(completed action marker); (modal particle indicating change of state, situation now); (modal particle intensifying preceding clause)||to finish; to achieve; variant of 了[liǎo]; to understand clearly||(of eyes) bright; clear-sighted; to understand clearly";"一个 (yīgè; non-hsk)";"No definition found";"洞 (cave; dòng; hsk5)";"cave/hole/zero (unambiguous spoken form when spelling out numbers)/CL:个[gè]"
"他则着古人的行事风格。";"tā zé zhe gǔrén de xíngshì fēnggé.";"He imitates the style of the ancients.";"他 (he; tā; hsk1)";"he; him (used for either sex when the sex is unknown or unimportant)/(used before sb's name for emphasis)/(used as a meaningless mock object)/(literary) other";"则 (standard; zé; hsk5)";"(literary) (conjunction used to express contrast with a previous clause) but; then/(bound form) standard; norm/(bound form) principle/(literary) to imitate; to follow/classifier for written items";"着 (move/touch; zhāo||zháo||zhe||zhuó; hsk2)";"(chess) move; trick; all right!; (dialect) to add||to touch; to come in contact with; to feel; to be affected by; to catch fire; to burn; (coll.) to fall asleep; (after a verb) hitting the mark; succeeding in||aspect particle indicating action in progress or ongoing state||to wear (clothes); to contact; to use; to apply";"古人 (gǔrén; non-hsk)";"people of ancient times/the ancients/extinct human species such as Homo erectus or Homo neanderthalensis/(literary) deceased person";"的 (of; de||dī||dí||dì; also pr. dì or di in poetry and songs; hsk1)";"of; ~'s (possessive particle); (used after an attribute); (used to form a nominal expression); (used at the end of a declarative sentence for emphasis); a cab (abbr. for 的士[dī shì])||really and truly||(bound form) bull's-eye; target";"行事 (xíngshì; non-hsk)";"to execute/to handle/behavior/action/conduct";"风格 (style; fēnggé; hsk5|stront1)";"style"
"我们需要客观而不是主观的分析。";"wǒmen xūyào kèguān ér bùshì zhǔguān de fēnxī.";"We need objective rather than subjective analysis.";"我们 (we; wǒmen; hsk1)";"we; us; ourselves; our";"需要 (need; xūyào; hsk3|stront1)";"to need; to want; to demand; to require/needs";"客观 (objective; kèguān; hsk5|stront2)";"objective/impartial";"而 (and; ér; hsk4)";"and/as well as/and so/but (not)/yet (not)/(indicates causal relation)/(indicates change of state)/(indicates contrast)";"不是 (bùshì||bùshi; non-hsk)";"no; is not; not||fault; blame";"主观 (subjective; zhǔguān; hsk5|stront1)";"subjective";"的 (of; de||dī||dí||dì; also pr. dì or di in poetry and songs; hsk1)";"of; ~'s (possessive particle); (used after an attribute); (used to form a nominal expression); (used at the end of a declarative sentence for emphasis); a cab (abbr. for 的士[dī shì])||really and truly||(bound form) bull's-eye; target";"分析 (analyze; fēnxī; hsk5|stront2)";"to analyze/analysis/CL:个[gè]"
"他的前途一片光明。";"tā de qiántú yīpiàn guāngmíng.";"His future prospects are very promising.";"他 (he; tā; hsk1)";"he; him (used for either sex when the sex is unknown or unimportant)/(used before sb's name for emphasis)/(used as a meaningless mock object)/(literary) other";"的 (of; de||dī||dí||dì; also pr. dì or di in poetry and songs; hsk1)";"of; ~'s (possessive particle); (used after an attribute); (used to form a nominal expression); (used at the end of a declarative sentence for emphasis); a cab (abbr. for 的士[dī shì])||really and truly||(bound form) bull's-eye; target";"前途 (prospects; qiántú; hsk5)";"prospects/future outlook/journey";"一片 (yīpiàn; non-hsk)";"No definition found";"光明 (light; guāngmíng; hsk5)";"light/radiance/(fig.) bright (prospects etc)/openhearted"
"这两个观点存在矛盾。";"zhè liǎnggè guāndiǎn cúnzài máodùn.";"These two views are contradictory.";"这 (this; zhè; commonly pr. zhèi esp. in Beijing; non-hsk)";"(pronoun) this; these/(bound form) this; the (followed by a noun)/(bound form) this";"两个 (liǎnggè; non-hsk)";"No definition found";"观点 (viewpoint; guāndiǎn; hsk5|stront2)";"point of view/viewpoint/standpoint/CL:个[gè]";"存在 (exist; cúnzài; hsk5|stront1|stront2)";"to exist/to be/existence";"矛盾 (contradiction; máodùn; hsk5|stront2)";"contradiction/CL:个[gè]/conflicting views/contradictory"
"保险公司会赔偿你的损失。";"bǎoxiǎngōngsī huì péicháng nǐ de sǔnshī.";"The insurance company will compensate for your loss.";"保险公司 (bǎoxiǎngōngsī; non-hsk)";"No definition found";"会 (can; huì||kuài; Taiwan pr. huǐ; hsk1)";"can; to have the skill; to know how to; to be likely to; to be sure to; to meet; to get together; meeting; gathering; (suffix) union; group; association; accounting; accountant";"赔偿 (compensate; péicháng; hsk5)";"to compensate";"你 (you; nǐ; hsk1)";"you (informal, as opposed to courteous 您[nín]); you (Note: In Taiwan, 妳 is used to address females, but in mainland China, it is not commonly used. Instead, 你 is used to address both males and females.)";"的 (of; de||dī||dí||dì; also pr. dì or di in poetry and songs; hsk1)";"of; ~'s (possessive particle); (used after an attribute); (used to form a nominal expression); (used at the end of a declarative sentence for emphasis); a cab (abbr. for 的士[dī shì])||really and truly||(bound form) bull's-eye; target";"损失 (loss; sǔnshī; hsk5)";"loss/damage/CL:个[gè]/to lose/to suffer damage"
"这两幅画风格相似。";"zhè liǎngfú huà fēnggé xiāngsì.";"These two paintings have a similar style.";"这 (this; zhè; commonly pr. zhèi esp. in Beijing; non-hsk)";"(pronoun) this; these/(bound form) this; the (followed by a noun)/(bound form) this";"两幅 (liǎngfú; non-hsk)";"No definition found";"画 (to draw; huà; hsk3)";"to draw; to paint/picture; painting (CL:幅[fú],张[zhāng])/to draw (a line) (variant of 划[huà])/stroke of a Chinese character (variant of 划[huà])/(calligraphy) horizontal stroke (variant of 划[huà])";"风格 (style; fēnggé; hsk5|stront1)";"style";"相似 (similar; xiāngsì; hsk5)";"similar; alike"
"他赞美了她的勇气和决心。";"tā zànměi le tā de yǒngqì hé juéxīn.";"He praised her courage and determination.";"他 (he; tā; hsk1)";"he; him (used for either sex when the sex is unknown or unimportant)/(used before sb's name for emphasis)/(used as a meaningless mock object)/(literary) other";"赞美 (praise; zànměi; hsk5|stront1)";"to admire/to praise/to eulogize";"了 (finish; le||liǎo||liǎo; hsk1)";"(completed action marker); (modal particle indicating change of state, situation now); (modal particle intensifying preceding clause)||to finish; to achieve; variant of 了[liǎo]; to understand clearly||(of eyes) bright; clear-sighted; to understand clearly";"她 (she; tā; hsk1)";"she";"的 (of; de||dī||dí||dì; also pr. dì or di in poetry and songs; hsk1)";"of; ~'s (possessive particle); (used after an attribute); (used to form a nominal expression); (used at the end of a declarative sentence for emphasis); a cab (abbr. for 的士[dī shì])||really and truly||(bound form) bull's-eye; target";"勇气 (courage; yǒngqì; hsk5)";"courage/valor";"和 (together; hé||hé||hè||hú||huó||huò; Taiwan pr. hàn; Taiwan pr. huò; hsk1)";"together with; (math.) sum; to make peace; (sports) to draw; to tie; (bound form) harmonious; (bound form) Japan; to join in the singing; to chime in with others||to complete a set in mahjong or playing cards||to combine a powdery substance (flour, plaster etc) with water; to blend; classifier for rinses of clothes; classifier for boilings of medicinal herbs; surname He||(joining two nouns) and; Japanese||to compose a poem in reply (to sb's poem) using the same rhyme sequence";"决心 (determination; juéxīn; hsk5)";"determination/resolution/determined/firm and resolute/to make up one's mind/CL:个[gè]"
"学校培养了很多人才。";"xuéxiào péiyǎng le hěnduō réncái.";"The school has cultivated many talents.";"学校 (school; xuéxiào; hsk1)";"school/CL:所[suǒ]";"培养 (to cultivate; péiyǎng; hsk5)";"to cultivate/to breed/to foster/to nurture/to educate/to groom (for a position)/education/fostering/culture (biology)";"了 (finish; le||liǎo||liǎo; hsk1)";"(completed action marker); (modal particle indicating change of state, situation now); (modal particle intensifying preceding clause)||to finish; to achieve; variant of 了[liǎo]; to understand clearly||(of eyes) bright; clear-sighted; to understand clearly";"很多 (hěnduō; non-hsk)";"No definition found";"人才 (talent; réncái; hsk5|stront2)";"talent/talented person/looks/attractive looks"
"这个机器的毛病很多。";"zhège jīqì de máobìng hěnduō.";"This machine has many defects.";"这个 (zhège; non-hsk)";"(pronoun) this/(adjective) this";"机器 (machine; jīqì; hsk5)";"machine/CL:台[tái],部[bù],个[gè]";"的 (of; de||dī||dí||dì; also pr. dì or di in poetry and songs; hsk1)";"of; ~'s (possessive particle); (used after an attribute); (used to form a nominal expression); (used at the end of a declarative sentence for emphasis); a cab (abbr. for 的士[dī shì])||really and truly||(bound form) bull's-eye; target";"毛病 (fault; máobìng; hsk5)";"fault/defect/shortcomings/ailment/CL:个[gè]";"很多 (hěnduō; non-hsk)";"No definition found"
"他在家庭中的地位很特殊。";"tā zài jiātíng zhōng de dìwèi hěn tèshū.";"His place in the family is very special.";"他 (he; tā; hsk1)";"he; him (used for either sex when the sex is unknown or unimportant)/(used before sb's name for emphasis)/(used as a meaningless mock object)/(literary) other";"在 (exist; zài; hsk1)";"to exist; to be alive/(of sb or sth) to be (located) at/(used before a verb to indicate an action in progress)";"家庭 (family; jiātíng; hsk5|stront1)";"family/household/CL:户[hù],个[gè]";"中 (middle; zhōng||zhōng||zhòng; non-hsk)";"among; in; middle; center; while (doing sth); during; (dialect) OK; all right||to hit (the mark); to be hit by; to suffer; to win (a prize, a lottery); surname Zhong||within; China; Chinese";"的 (of; de||dī||dí||dì; also pr. dì or di in poetry and songs; hsk1)";"of; ~'s (possessive particle); (used after an attribute); (used to form a nominal expression); (used at the end of a declarative sentence for emphasis); a cab (abbr. for 的士[dī shì])||really and truly||(bound form) bull's-eye; target";"地位 (position; dìwèi; hsk5)";"position/status/place/CL:个[gè]";"很 (very; hěn; hsk1)";"(adverb of degree)/quite/very/awfully";"特殊 (special; tèshū; hsk5)";"special/particular/unusual/extraordinary"
"她扶着墙站了起来。";"tā fú zhe qiáng zhàn le qǐlai.";"She supported herself by the wall and stood up.";"她 (she; tā; hsk1)";"she";"扶 (support; fú; hsk5)";"to support with the hand/to help sb up/to support oneself by holding onto something/to help";"着 (move/touch; zhāo||zháo||zhe||zhuó; hsk2)";"(chess) move; trick; all right!; (dialect) to add||to touch; to come in contact with; to feel; to be affected by; to catch fire; to burn; (coll.) to fall asleep; (after a verb) hitting the mark; succeeding in||aspect particle indicating action in progress or ongoing state||to wear (clothes); to contact; to use; to apply";"墙 (wall; qiáng; hsk5)";"wall (CL:面[miàn],堵[dǔ]); (slang) to block (a website) (usu. in the passive: 被牆|被墙[bèi qiáng])";"站 (stand; zhàn; hsk3)";"station/to stand/to halt/to stop/branch of a company or organization/website";"了 (finish; le||liǎo||liǎo; hsk1)";"(completed action marker); (modal particle indicating change of state, situation now); (modal particle intensifying preceding clause)||to finish; to achieve; variant of 了[liǎo]; to understand clearly||(of eyes) bright; clear-sighted; to understand clearly";"起来 (beginning; qǐlai||qilai; also pr. qǐ lái; also pr. qǐ lai; hsk3)";"to stand up; to get up; indicating an upward movement (e.g. after 站[zhàn]); indicating completion; (after a perception verb, e.g. 看[kàn]) expressing preliminary judgment"
"我需要去看内科。";"wǒ xūyào qù kàn nèikē.";"I need to see a general medicine doctor.";"我 (I; wǒ; hsk1)";"me; my; I";"需要 (need; xūyào; hsk3|stront1)";"to need; to want; to demand; to require/needs";"去 (to go; qù; hsk1)";"to go/to go to (a place)/(of a time etc) last/just passed/to send/to remove/to get rid of/to reduce/to be apart from in space or time/to die (euphemism)/to play (a part)/(when used either before or after a verb) to go in order to do sth/(after a verb of motion indicates movement away from the speaker)/(used after certain verbs to indicate detachment or separation)";"看 (look; kān||kàn; hsk1)";"to look after; to take care of; to watch; to guard||to see; to look at; to read; to watch; to visit; to call on; to consider; to regard as; to look after; to treat (a patient or illness); to depend on; to feel (that); (after a verb) to give it a try; to watch out for";"内科 (internal medicine; nèikē; hsk5)";"internal medicine; general medicine"
"我们需要配合工作。";"wǒmen xūyào pèihé gōngzuò.";"We need to coordinate our work.";"我们 (we; wǒmen; hsk1)";"we; us; ourselves; our";"需要 (need; xūyào; hsk3|stront1)";"to need; to want; to demand; to require/needs";"配合 (matching; pèihé; hsk5)";"matching/fitting in with/compatible with/to correspond/to fit/to conform to/rapport/to coordinate with/to act in concert with/to cooperate/to become man and wife/to combine parts of machine";"工作 (work; gōngzuò; hsk1)";"to work/(of a machine) to operate/job/work/task/CL:个[gè],份[fèn],项[xiàng]"
"我们应该提倡环保。";"wǒmen yīnggāi tíchàng huánbǎo.";"We should promote environmental protection.";"我们 (we; wǒmen; hsk1)";"we; us; ourselves; our";"应该 (should; yīnggāi; hsk3)";"ought to/should/must";"提倡 (promote; tíchàng; hsk5)";"to promote/to advocate";"环保 (environmental; huánbǎo; non-hsk)";"environmental protection/environmentally friendly/abbr. for 環境保護|环境保护[huán jìng bǎo hù]"
"她连忙道歉。";"tā liánmáng dàoqiàn.";"She promptly apologized.";"她 (she; tā; hsk1)";"she";"连忙 (promptly; liánmáng; hsk5)";"promptly/at once";"道歉 (apologize; dàoqiàn; hsk4)";"to apologize"
"他欠我一笔钱。";"tā qiàn wǒ yībǐ qián.";"He owes me some money.";"他 (he; tā; hsk1)";"he; him (used for either sex when the sex is unknown or unimportant)/(used before sb's name for emphasis)/(used as a meaningless mock object)/(literary) other";"欠 (lack; qiàn; hsk5)";"to owe/to lack/(literary) to be deficient in/(bound form) yawn/to raise slightly (a part of one's body)";"我 (I; wǒ; hsk1)";"me; my; I";"一笔 (yībǐ; non-hsk)";"No definition found";"钱 (coin; qián; hsk1)";"coin; money; unit of weight, one tenth of a tael 两[liǎng]; surname Qian; CL:笔[bǐ]"
"她喜欢戴银饰。";"tā xǐhuan dàiyínshì.";"She likes to wear silver jewelry.";"她 (she; tā; hsk1)";"she";"喜欢 (like; xǐhuan; hsk1)";"to like; to be fond of";"戴银饰 (dàiyínshì; non-hsk)";"No definition found"
"中旬是我们公司的财务总结时期。";"zhōngxún shì wǒmen gōngsī de cáiwù zǒngjié shíqī.";"The middle third of the month is the financial summary period for our company.";"中旬 (middle third; zhōngxún; hsk5)";"middle third of a month";"是 (to be; shì; hsk1)";"to be (followed by substantives only); correct; right; true; (respectful acknowledgement of a command) very well; (adverb for emphatic assertion)";"我们 (we; wǒmen; hsk1)";"we; us; ourselves; our";"公司 (company; gōngsī; hsk2|stront1)";"company; firm; corporation/CL:家[jiā]";"的 (of; de||dī||dí||dì; also pr. dì or di in poetry and songs; hsk1)";"of; ~'s (possessive particle); (used after an attribute); (used to form a nominal expression); (used at the end of a declarative sentence for emphasis); a cab (abbr. for 的士[dī shì])||really and truly||(bound form) bull's-eye; target";"财务 (financial; cáiwù; hsk6)";"financial affairs";"总结 (sum up; zǒngjié; hsk4|stront1)";"to sum up/to conclude/summary/résumé/CL:个[gè]";"时期 (period; shíqī; hsk5)";"period/phase/CL:个[gè]"
"她试图阻止他离开。";"tā shìtú zǔzhǐ tā líkāi.";"She tried to stop him from leaving.";"她 (she; tā; hsk1)";"she";"试图 (attempt; shìtú; hsk6)";"to attempt/to try";"阻止 (prevent; zǔzhǐ; hsk5)";"to prevent/to block";"他 (he; tā; hsk1)";"he; him (used for either sex when the sex is unknown or unimportant)/(used before sb's name for emphasis)/(used as a meaningless mock object)/(literary) other";"离开 (depart; líkāi; hsk3)";"to depart; to leave"
"校内设施很完善。";"xiàonèi shèshī hěn wánshàn.";"The on-campus facilities are very comprehensive.";"校内 (on-campus; xiàonèi; stront1)";"on-campus; intramural; Xiaonei (Chinese social network website)";"设施 (facilities; shèshī; hsk5)";"facilities/installation";"很 (very; hěn; hsk1)";"(adverb of degree)/quite/very/awfully";"完善 (improve; wánshàn; hsk5)";"(of systems, facilities etc) comprehensive/well-developed/excellent/to refine/to improve"
"这杯咖啡太浓了。";"zhèbēi kāfēi tài nóng le.";"This cup of coffee is too strong.";"这杯 (zhèbēi; non-hsk)";"No definition found";"咖啡 (coffee; kāfēi; hsk2)";"coffee (loanword)/CL:杯[bēi]";"太 (highest; tài; hsk1)";"highest/greatest/too (much)/very/extremely";"浓 (concentrated; nóng; hsk5)";"concentrated/dense/strong (smell etc)";"了 (finish; le||liǎo||liǎo; hsk1)";"(completed action marker); (modal particle indicating change of state, situation now); (modal particle intensifying preceding clause)||to finish; to achieve; variant of 了[liǎo]; to understand clearly||(of eyes) bright; clear-sighted; to understand clearly"
"农民正在收割玉米。";"nóngmín zhèngzài shōugē yùmǐ.";"The farmers are harvesting corn.";"农民 (farmer; nóngmín; hsk5|stront1)";"peasant; farmer";"正在 (just at; zhèngzài; hsk2)";"just at (that time)/right in (that place)/right in the middle of (doing sth)";"收割 (shōugē; non-hsk)";"to harvest/to reap/to gather in crops";"玉米 (corn; yùmǐ; hsk5)";"corn/maize/CL:粒[lì]"
"他今天早上报到了。";"tā jīntiān zǎoshang bàodào le.";"He checked in this morning.";"他 (he; tā; hsk1)";"he; him (used for either sex when the sex is unknown or unimportant)/(used before sb's name for emphasis)/(used as a meaningless mock object)/(literary) other";"今天 (today; jīntiān; hsk1)";"today/the present time; now";"早上 (morning; zǎoshang; hsk2)";"early morning/CL:个[gè]";"报到 (report for duty; bàodào; hsk5)";"to report for duty/to check in/to register";"了 (finish; le||liǎo||liǎo; hsk1)";"(completed action marker); (modal particle indicating change of state, situation now); (modal particle intensifying preceding clause)||to finish; to achieve; variant of 了[liǎo]; to understand clearly||(of eyes) bright; clear-sighted; to understand clearly"
"风筝在空中飘。";"fēngzhēng zài kōngzhōng piāo.";"The kite is floating in the air.";"风筝 (fēngzhēng; non-hsk)";"kite";"在 (exist; zài; hsk1)";"to exist; to be alive/(of sb or sth) to be (located) at/(used before a verb to indicate an action in progress)";"空中 (in the air; kōngzhōng; non-hsk)";"in the sky/in the air";"飘 (float; piāo; hsk5)";"to float (in the air); to flutter; to waft; complacent; frivolous; weak; shaky; wobbly"
"作为球迷，他从不缺席比赛。";"zuòwéi qiúmí, tā cóngbù quēxí bǐsài.";"As a fan, he never misses a game.";"作为 (conduct; zuòwéi; hsk5)";"one's conduct/deed/activity/accomplishment/achievement/to act as/as (in the capacity of)/qua/to view as/to look upon (sth as)/to take sth to be";"球迷 (fan; qiúmí; hsk5)";"fan (ball sports)/CL:个[gè]";"他 (he; tā; hsk1)";"he; him (used for either sex when the sex is unknown or unimportant)/(used before sb's name for emphasis)/(used as a meaningless mock object)/(literary) other";"从不 (never; cóngbù; non-hsk)";"never";"缺席 (absent; quēxí; hsk6)";"to be absent";"比赛 (competition; bǐsài; hsk3)";"competition (sports etc)/match/CL:场[chǎng],次[cì]/to compete"
"工厂需要进口原料。";"gōngchǎng xūyào jìnkǒu yuánliào.";"The factory needs to import raw materials.";"工厂 (factory; gōngchǎng; hsk5)";"factory/CL:家[jiā],座[zuò]";"需要 (need; xūyào; hsk3|stront1)";"to need; to want; to demand; to require/needs";"进口 (import; jìnkǒu; hsk5)";"to import/imported/entrance/inlet (for the intake of air, water etc)";"原料 (raw material; yuánliào; hsk5)";"raw material"
"她的痛苦程度超出了我们的想象。";"tā de tòngkǔ chéngdù chāochū le wǒmen de xiǎngxiàng.";"The extent of her pain exceeded our imagination.";"她 (she; tā; hsk1)";"she";"的 (of; de||dī||dí||dì; also pr. dì or di in poetry and songs; hsk1)";"of; ~'s (possessive particle); (used after an attribute); (used to form a nominal expression); (used at the end of a declarative sentence for emphasis); a cab (abbr. for 的士[dī shì])||really and truly||(bound form) bull's-eye; target";"痛苦 (suffering; tòngkǔ; hsk5|stront2)";"pain/suffering/painful/CL:个[gè]";"程度 (degree; chéngdù; hsk5|stront1)";"degree; level; extent";"超出 (exceed; chāochū; non-hsk)";"to exceed/to overstep/to go too far/to encroach";"了 (finish; le||liǎo||liǎo; hsk1)";"(completed action marker); (modal particle indicating change of state, situation now); (modal particle intensifying preceding clause)||to finish; to achieve; variant of 了[liǎo]; to understand clearly||(of eyes) bright; clear-sighted; to understand clearly";"我们 (we; wǒmen; hsk1)";"we; us; ourselves; our";"的 (of; de||dī||dí||dì; also pr. dì or di in poetry and songs; hsk1)";"of; ~'s (possessive particle); (used after an attribute); (used to form a nominal expression); (used at the end of a declarative sentence for emphasis); a cab (abbr. for 的士[dī shì])||really and truly||(bound form) bull's-eye; target";"想象 (imagine; xiǎngxiàng; hsk5)";"to imagine; to envision/imagination"
"不要被狭隘的观念所限制。";"bùyào bèi xiáài de guānniàn suǒ xiànzhì.";"Don't be limited by narrow-minded ideas.";"不要 (don't; bùyào; non-hsk)";"don't!; must not";"被 (cover; bèi; hsk3)";"quilt/to cover (with)/(literary) to suffer (a misfortune)/used to indicate passive voice (placed before the doer of the action like ""by"" in English passive-voice sentences, or, if the doer is not mentioned, before the verb)/(since c. 2009) (sarcastic or jocular) used to indicate that the following word should be regarded as being in air quotes (as in 被旅遊|被旅游[bèi lu:3 yóu] to ""go on a trip"", for example)";"狭隘 (narrow; xiáài; hsk6)";"narrow/tight/narrow minded/lacking in experience";"的 (of; de||dī||dí||dì; also pr. dì or di in poetry and songs; hsk1)";"of; ~'s (possessive particle); (used after an attribute); (used to form a nominal expression); (used at the end of a declarative sentence for emphasis); a cab (abbr. for 的士[dī shì])||really and truly||(bound form) bull's-eye; target";"观念 (notion; guānniàn; hsk5)";"notion/thought/concept/sense/views/ideology/general impressions";"所 (place; suǒ; hsk5)";"actually/place/classifier for houses, small buildings, institutions etc/that which/particle introducing a relative clause or passive/CL:个[gè]";"限制 (restrict; xiànzhì; hsk5|stront2)";"to restrict/to limit/to confine/restriction/limit/CL:个[gè]"
"迟早有一天，我会实现我的梦想。";"chízǎo yǒu yītiān, wǒhuì shíxiàn wǒ de mèngxiǎng.";"Sooner or later, I will achieve my dream.";"迟早 (sooner or later; chízǎo; hsk5)";"sooner or later";"有 (have; yǒu; hsk1)";"to have; there is/(bound form) having; with; -ful; -ed; -al (as in 有意[yǒu yì] intentional)";"一天 (yītiān; non-hsk)";"No definition found";"我会 (wǒhuì; non-hsk)";"No definition found";"实现 (achieve; shíxiàn; hsk5)";"to achieve; to implement; to realize; to bring about";"我 (I; wǒ; hsk1)";"me; my; I";"的 (of; de||dī||dí||dì; also pr. dì or di in poetry and songs; hsk1)";"of; ~'s (possessive particle); (used after an attribute); (used to form a nominal expression); (used at the end of a declarative sentence for emphasis); a cab (abbr. for 的士[dī shì])||really and truly||(bound form) bull's-eye; target";"梦想 (dream; mèngxiǎng; hsk5)";"(fig.) to dream of/dream"
