"他被电影的结局雷到了。";"tā bèi diànyǐng de jiéjú léidào le.";"He was shocked by the movie's ending.";"他 (he; tā; hsk1)";"he; him (used for either sex when the sex is unknown or unimportant)/(used before sb's name for emphasis)/(used as a meaningless mock object)/(literary) other";"被 (cover; bèi; hsk3)";"quilt/to cover (with)/(literary) to suffer (a misfortune)/used to indicate passive voice (placed before the doer of the action like ""by"" in English passive-voice sentences, or, if the doer is not mentioned, before the verb)/(since c. 2009) (sarcastic or jocular) used to indicate that the following word should be regarded as being in air quotes (as in 被旅遊|被旅游[bèi lu:3 yóu] to ""go on a trip"", for example)";"电影 (movie; diànyǐng; hsk1)";"movie; film/CL:部[bù],片[piàn],幕[mù],场[chǎng]";"的 (of; de||dī||dí||dì; also pr. dì or di in poetry and songs; hsk1)";"of; ~'s (possessive particle); (used after an attribute); (used to form a nominal expression); (used at the end of a declarative sentence for emphasis); a cab (abbr. for 的士[dī shì])||really and truly||(bound form) bull's-eye; target";"结局 (conclusion; jiéjú; hsk6)";"conclusion/ending";"雷到 (léidào; non-hsk)";"No definition found";"了 (finish; le||liǎo||liǎo; hsk1)";"(completed action marker); (modal particle indicating change of state, situation now); (modal particle intensifying preceding clause)||to finish; to achieve; variant of 了[liǎo]; to understand clearly||(of eyes) bright; clear-sighted; to understand clearly"
"思想开放是一个进步的标志。";"sīxiǎngkāifàng shì yīgè jìnbù de biāozhì.";"Open-mindedness is a sign of progress.";"思想开放 (open-minded; sīxiǎngkāifàng; stront1)";"Open-minded";"是 (to be; shì; hsk1)";"to be (followed by substantives only); correct; right; true; (respectful acknowledgement of a command) very well; (adverb for emphatic assertion)";"一个 (yīgè; non-hsk)";"No definition found";"进步 (progress; jìnbù; hsk5|stront1)";"progress; improvement/to improve; to progress/CL:个[gè]";"的 (of; de||dī||dí||dì; also pr. dì or di in poetry and songs; hsk1)";"of; ~'s (possessive particle); (used after an attribute); (used to form a nominal expression); (used at the end of a declarative sentence for emphasis); a cab (abbr. for 的士[dī shì])||really and truly||(bound form) bull's-eye; target";"标志 (sign; biāozhì; hsk5)";"sign; mark; symbol; logo/to symbolize; to indicate; to mark"
"她的反应很夸张。";"tā de fǎnyìng hěn kuāzhāng.";"Her reaction is exaggerated.";"她 (she; tā; hsk1)";"she";"的 (of; de||dī||dí||dì; also pr. dì or di in poetry and songs; hsk1)";"of; ~'s (possessive particle); (used after an attribute); (used to form a nominal expression); (used at the end of a declarative sentence for emphasis); a cab (abbr. for 的士[dī shì])||really and truly||(bound form) bull's-eye; target";"反应 (react; fǎnyìng; hsk5|stront2)";"to react/to respond/reaction/response/reply/chemical reaction/CL:个[gè]";"很 (very; hěn; hsk1)";"(adverb of degree)/quite/very/awfully";"夸张 (exaggerate; kuāzhāng; hsk5|stront1)";"to exaggerate/overstated; exaggerated/hyperbole/(coll.) excessive; ridiculous; outrageous"
"我对他的动机产生了疑问。";"wǒ duì tā de dòngjī chǎnshēng le yíwèn.";"I have doubts about his motives.";"我 (I; wǒ; hsk1)";"me; my; I";"对 (opposite; duì; hsk2)";"right; correct/towards; at; for/concerning; regarding/to treat (sb a certain way)/to face/(bound form) opposite; facing; matching/to match together; to adjust/to fit; to suit/to answer; to reply/to add; to pour in (a fluid)/to check; to compare/classifier: couple; pair";"他 (he; tā; hsk1)";"he; him (used for either sex when the sex is unknown or unimportant)/(used before sb's name for emphasis)/(used as a meaningless mock object)/(literary) other";"的 (of; de||dī||dí||dì; also pr. dì or di in poetry and songs; hsk1)";"of; ~'s (possessive particle); (used after an attribute); (used to form a nominal expression); (used at the end of a declarative sentence for emphasis); a cab (abbr. for 的士[dī shì])||really and truly||(bound form) bull's-eye; target";"动机 (motive; dòngjī; hsk6)";"motive; motivation";"产生 (to arise; chǎnshēng; hsk5)";"to arise; to come into being; to come about/to give rise to; to bring into being; to bring about; to produce; to engender; to generate";"了 (finish; le||liǎo||liǎo; hsk1)";"(completed action marker); (modal particle indicating change of state, situation now); (modal particle intensifying preceding clause)||to finish; to achieve; variant of 了[liǎo]; to understand clearly||(of eyes) bright; clear-sighted; to understand clearly";"疑问 (doubt; yíwèn; hsk5)";"question/interrogation/doubt"
"这道菜闻起来很香。";"zhè dàocài wén qǐlai hěnxiāng.";"This dish smells very fragrant.";"这 (this; zhè; commonly pr. zhèi esp. in Beijing; non-hsk)";"(pronoun) this; these/(bound form) this; the (followed by a noun)/(bound form) this";"道菜 (dàocài; non-hsk)";"No definition found";"闻 (hear; wén; hsk5)";"to hear; news; well-known; famous; reputation; fame; to smell; to sniff at; surname Wen";"起来 (beginning; qǐlai||qilai; also pr. qǐ lái; also pr. qǐ lai; hsk3)";"to stand up; to get up; indicating an upward movement (e.g. after 站[zhàn]); indicating completion; (after a perception verb, e.g. 看[kàn]) expressing preliminary judgment";"很香 (hěnxiāng; non-hsk)";"No definition found"
"他在研究相关的资料。";"tā zài yánjiū xiāngguān de zīliào.";"He is researching relevant materials.";"他 (he; tā; hsk1)";"he; him (used for either sex when the sex is unknown or unimportant)/(used before sb's name for emphasis)/(used as a meaningless mock object)/(literary) other";"在 (exist; zài; hsk1)";"to exist; to be alive/(of sb or sth) to be (located) at/(used before a verb to indicate an action in progress)";"研究 (research; yánjiū; hsk4)";"research/a study/CL:项[xiàng]/to research/to look into";"相关 (related; xiāngguān; hsk5)";"related/relevant/pertinent/to be interrelated/(statistics) correlation";"的 (of; de||dī||dí||dì; also pr. dì or di in poetry and songs; hsk1)";"of; ~'s (possessive particle); (used after an attribute); (used to form a nominal expression); (used at the end of a declarative sentence for emphasis); a cab (abbr. for 的士[dī shì])||really and truly||(bound form) bull's-eye; target";"资料 (data; zīliào; hsk5)";"material/resources/data/information/profile (Internet)/CL:份[fèn],个[gè]"
"中国有十四亿人口。";"zhōngguó yǒu shísì yì rénkǒu.";"China has 1.4 billion people.";"中国 (China; zhōngguó; hsk1)";"China";"有 (have; yǒu; hsk1)";"to have; there is/(bound form) having; with; -ful; -ed; -al (as in 有意[yǒu yì] intentional)";"十四 (shísì; non-hsk)";"fourteen; 14";"亿 (100 million; yì; hsk5)";"100 million";"人口 (population; rénkǒu; hsk5)";"population/people"
"他们发现了这个现象的规律。";"tāmen fāxiàn le zhège xiànxiàng de guīlǜ.";"They discovered the regular pattern of this phenomenon.";"他们 (they; tāmen; non-hsk)";"they; them";"发现 (discover; fāxiàn; hsk3)";"to notice; to become aware of/to discover; to find; to detect/a discovery";"了 (finish; le||liǎo||liǎo; hsk1)";"(completed action marker); (modal particle indicating change of state, situation now); (modal particle intensifying preceding clause)||to finish; to achieve; variant of 了[liǎo]; to understand clearly||(of eyes) bright; clear-sighted; to understand clearly";"这个 (zhège; non-hsk)";"(pronoun) this/(adjective) this";"现象 (phenomenon; xiànxiàng; hsk5|stront1)";"phenomenon/CL:个[gè],种[zhǒng]/appearance";"的 (of; de||dī||dí||dì; also pr. dì or di in poetry and songs; hsk1)";"of; ~'s (possessive particle); (used after an attribute); (used to form a nominal expression); (used at the end of a declarative sentence for emphasis); a cab (abbr. for 的士[dī shì])||really and truly||(bound form) bull's-eye; target";"规律 (rule; guīlǜ; hsk5|stront1)";"rule (e.g. of science)/law of behavior/regular pattern/rhythm/discipline"
"他追求物质享受。";"tā zhuīqiú wùzhìxiǎngshòu.";"He pursues material enjoyment.";"他 (he; tā; hsk1)";"he; him (used for either sex when the sex is unknown or unimportant)/(used before sb's name for emphasis)/(used as a meaningless mock object)/(literary) other";"追求 (pursue; zhuīqiú; hsk5)";"to pursue (a goal etc) stubbornly/to seek after/to woo";"物质享受 (wùzhìxiǎngshòu; non-hsk)";"material benefits"
"蓝曦臣亲自接待了每一位嘉宾。";"lánxīchén qīnzì jiēdài le měi yīwèi jiābīn.";"Lan Xichen personally received every esteemed guest.";"蓝曦臣 (lánxīchén; non-hsk)";"No definition found";"亲自 (personally; qīnzì; hsk5|stront1)";"personally/in person/oneself";"接待 (receive; jiēdài; hsk5)";"to receive; to entertain; to host (guests, visitors or clients)";"了 (finish; le||liǎo||liǎo; hsk1)";"(completed action marker); (modal particle indicating change of state, situation now); (modal particle intensifying preceding clause)||to finish; to achieve; variant of 了[liǎo]; to understand clearly||(of eyes) bright; clear-sighted; to understand clearly";"每 (each; měi; hsk2)";"each/every";"一位 (yīwèi; non-hsk)";"No definition found";"嘉宾 (guest; jiābīn; hsk5)";"esteemed guest/honored guest/guest (on a show)"
"这些零件组成了整个机器。";"zhèxiē língjiàn zǔchéng le zhěnggè jīqì.";"These parts make up the entire machine.";"这些 (these; zhèxiē; non-hsk)";"these";"零件 (part; língjiàn; hsk5)";"part/component";"组成 (form; zǔchéng; hsk5)";"to form/to make up/to constitute";"了 (finish; le||liǎo||liǎo; hsk1)";"(completed action marker); (modal particle indicating change of state, situation now); (modal particle intensifying preceding clause)||to finish; to achieve; variant of 了[liǎo]; to understand clearly||(of eyes) bright; clear-sighted; to understand clearly";"整个 (whole; zhěnggè; hsk5)";"whole/entire/total";"机器 (machine; jīqì; hsk5)";"machine/CL:台[tái],部[bù],个[gè]"
"她的笑容显得很诚恳。";"tā de xiàoróng xiǎnde hěn chéngkěn.";"Her smile looks very sincere.";"她 (she; tā; hsk1)";"she";"的 (of; de||dī||dí||dì; also pr. dì or di in poetry and songs; hsk1)";"of; ~'s (possessive particle); (used after an attribute); (used to form a nominal expression); (used at the end of a declarative sentence for emphasis); a cab (abbr. for 的士[dī shì])||really and truly||(bound form) bull's-eye; target";"笑容 (smile; xiàoróng; non-hsk)";"smile/smiling expression/CL:副[fù]";"显得 (appear; xiǎnde; hsk5)";"to seem/to look/to appear";"很 (very; hěn; hsk1)";"(adverb of degree)/quite/very/awfully";"诚恳 (sincere; chéngkěn; hsk5)";"sincere/honest/cordial"
"这个设计体现了现代风格。";"zhège shèjì tǐxiàn le xiàndài fēnggé.";"This design embodies a modern style.";"这个 (zhège; non-hsk)";"(pronoun) this/(adjective) this";"设计 (design; shèjì; hsk5|stront1)";"to design; to plan/design; plan";"体现 (embody; tǐxiàn; hsk5)";"to embody/to reflect/to incarnate";"了 (finish; le||liǎo||liǎo; hsk1)";"(completed action marker); (modal particle indicating change of state, situation now); (modal particle intensifying preceding clause)||to finish; to achieve; variant of 了[liǎo]; to understand clearly||(of eyes) bright; clear-sighted; to understand clearly";"现代 (modern era; xiàndài; hsk5|stront1)";"modern times; modern age; modern era; Hyundai, South Korean company";"风格 (style; fēnggé; hsk5|stront1)";"style"
"她对未来充满了幻想。";"tā duì wèilái chōngmǎn le huànxiǎng.";"She is full of fantasies about the future.";"她 (she; tā; hsk1)";"she";"对 (opposite; duì; hsk2)";"right; correct/towards; at; for/concerning; regarding/to treat (sb a certain way)/to face/(bound form) opposite; facing; matching/to match together; to adjust/to fit; to suit/to answer; to reply/to add; to pour in (a fluid)/to check; to compare/classifier: couple; pair";"未来 (future; wèilái; hsk5|stront1)";"future/tomorrow/CL:个[gè]/approaching/coming/pending";"充满 (full; chōngmǎn; hsk5)";"full of/brimming with/very full/permeated";"了 (finish; le||liǎo||liǎo; hsk1)";"(completed action marker); (modal particle indicating change of state, situation now); (modal particle intensifying preceding clause)||to finish; to achieve; variant of 了[liǎo]; to understand clearly||(of eyes) bright; clear-sighted; to understand clearly";"幻想 (fantasize; huànxiǎng; hsk5)";"to fantasize; to imagine/an illusion; a fantasy"
"动词是句子中的核心成分之一。";"dòngcí shì jùzi zhōng de héxīn chéngfèn zhīyī.";"Verb is one of the core components in a sentence.";"动词 (verb; dòngcí; stront2)";"verb";"是 (to be; shì; hsk1)";"to be (followed by substantives only); correct; right; true; (respectful acknowledgement of a command) very well; (adverb for emphatic assertion)";"句子 (sentence; jùzi; hsk3)";"sentence/CL:个[gè]";"中 (middle; zhōng||zhōng||zhòng; non-hsk)";"among; in; middle; center; while (doing sth); during; (dialect) OK; all right||to hit (the mark); to be hit by; to suffer; to win (a prize, a lottery); surname Zhong||within; China; Chinese";"的 (of; de||dī||dí||dì; also pr. dì or di in poetry and songs; hsk1)";"of; ~'s (possessive particle); (used after an attribute); (used to form a nominal expression); (used at the end of a declarative sentence for emphasis); a cab (abbr. for 的士[dī shì])||really and truly||(bound form) bull's-eye; target";"核心 (core; héxīn; hsk5)";"core; nucleus";"成分 (component; chéngfèn; hsk5)";"composition; ingredient; element; component/one's social status/CL:个[gè]";"之一 (one of; zhīyī; non-hsk)";"one of (sth)/one out of a multitude/one (third, quarter, percent etc)"
"这位模特的身材非常苗条。";"zhèwèi mótè de shēncái fēicháng miáotiao.";"This model has a very slender figure.";"这位 (zhèwèi; non-hsk)";"this (person)";"模特 (model; mótè; hsk5)";"(fashion) model (loanword)";"的 (of; de||dī||dí||dì; also pr. dì or di in poetry and songs; hsk1)";"of; ~'s (possessive particle); (used after an attribute); (used to form a nominal expression); (used at the end of a declarative sentence for emphasis); a cab (abbr. for 的士[dī shì])||really and truly||(bound form) bull's-eye; target";"身材 (stature; shēncái; hsk5)";"stature/build (height and weight)/figure";"非常 (very; fēicháng; hsk2)";"very; really/unusual; extraordinary";"苗条 (slim; miáotiao; hsk5)";"(of a woman) slim/slender/graceful"
"她的表现极其出色。";"tā de biǎoxiàn jíqí chūsè.";"Her performance is extremely outstanding.";"她 (she; tā; hsk1)";"she";"的 (of; de||dī||dí||dì; also pr. dì or di in poetry and songs; hsk1)";"of; ~'s (possessive particle); (used after an attribute); (used to form a nominal expression); (used at the end of a declarative sentence for emphasis); a cab (abbr. for 的士[dī shì])||really and truly||(bound form) bull's-eye; target";"表现 (to show; biǎoxiàn; hsk5)";"to show/to show off/to display/to manifest/expression/manifestation/show/display/performance (at work etc)/behavior";"极其 (extremely; jíqí; hsk5)";"extremely";"出色 (remarkable; chūsè; hsk5)";"remarkable; outstanding"
"他们纷纷离开了。";"tāmen fēnfēn líkāi le.";"They left one by one.";"他们 (they; tāmen; non-hsk)";"they; them";"纷纷 (one after another; fēnfēn; hsk5)";"one after another/in succession/one by one/continuously/diverse/in profusion/numerous and confused/pell-mell";"离开 (depart; líkāi; hsk3)";"to depart; to leave";"了 (finish; le||liǎo||liǎo; hsk1)";"(completed action marker); (modal particle indicating change of state, situation now); (modal particle intensifying preceding clause)||to finish; to achieve; variant of 了[liǎo]; to understand clearly||(of eyes) bright; clear-sighted; to understand clearly"
"她的个性非常独特。";"tā de gèxìng fēicháng dútè.";"Her personality is very unique.";"她 (she; tā; hsk1)";"she";"的 (of; de||dī||dí||dì; also pr. dì or di in poetry and songs; hsk1)";"of; ~'s (possessive particle); (used after an attribute); (used to form a nominal expression); (used at the end of a declarative sentence for emphasis); a cab (abbr. for 的士[dī shì])||really and truly||(bound form) bull's-eye; target";"个性 (personality; gèxìng; hsk5)";"individuality/personality";"非常 (very; fēicháng; hsk2)";"very; really/unusual; extraordinary";"独特 (unique; dútè; hsk5|stront1)";"unique; distinctive"
"植物吸取阳光。";"zhíwù xīqǔ yángguāng.";"Plants absorb sunlight.";"植物 (plant; zhíwù; hsk4)";"plant/vegetation/CL:种[zhǒng]";"吸取 (to absorb; xīqǔ; hsk5)";"to absorb/to draw (a lesson, insight etc)/to assimilate";"阳光 (sunshine; yángguāng; hsk4)";"sunshine/(of personality) upbeat; energetic/transparent (open to public scrutiny)"
"为了梦想而奋斗。";"wèile mèngxiǎng ér fèndòu.";"Strive for your dreams.";"为了 (for; wèile; hsk3|stront1)";"for; for the purpose of; in order to";"梦想 (dream; mèngxiǎng; hsk5)";"(fig.) to dream of/dream";"而 (and; ér; hsk4)";"and/as well as/and so/but (not)/yet (not)/(indicates causal relation)/(indicates change of state)/(indicates contrast)";"奋斗 (strive; fèndòu; hsk5)";"to strive; to struggle"
"我感激你的帮助。";"wǒ gǎnjī nǐ de bāngzhù.";"I am thankful for your help.";"我 (I; wǒ; hsk1)";"me; my; I";"感激 (grateful; gǎnjī; hsk5|stront1)";"to be grateful/to appreciate/thankful";"你 (you; nǐ; hsk1)";"you (informal, as opposed to courteous 您[nín]); you (Note: In Taiwan, 妳 is used to address females, but in mainland China, it is not commonly used. Instead, 你 is used to address both males and females.)";"的 (of; de||dī||dí||dì; also pr. dì or di in poetry and songs; hsk1)";"of; ~'s (possessive particle); (used after an attribute); (used to form a nominal expression); (used at the end of a declarative sentence for emphasis); a cab (abbr. for 的士[dī shì])||really and truly||(bound form) bull's-eye; target";"帮助 (assistance; bāngzhù; hsk2|stront1)";"assistance; aid/to help; to assist"
"池塘里有很多鱼。";"chítáng lǐ yǒu hěnduō yú.";"There are many fish in the pond.";"池塘 (pond; chítáng; hsk5)";"pool/pond";"里 (inside; lǐ; hsk1)";"lining; interior; inside; internal; also written 里[lǐ]; li, ancient measure of length, approx. 500 m; neighborhood; ancient administrative unit of 25 families; (Tw) borough, administrative unit between the township 镇[zhèn] and neighborhood 邻[lín] levels; Li (surname)";"有 (have; yǒu; hsk1)";"to have; there is/(bound form) having; with; -ful; -ed; -al (as in 有意[yǒu yì] intentional)";"很多 (hěnduō; non-hsk)";"No definition found";"鱼 (fish; yú; hsk2)";"fish; surname Yu; CL:条[tiáo],尾[wěi]"
"我们要坚决维护国家的利益。";"wǒmen yào jiānjué wéihù guójiā de lìyì.";"We must resolutely safeguard the interests of the country.";"我们 (we; wǒmen; hsk1)";"we; us; ourselves; our";"要 (demand; yāo||yào; hsk2)";"(bound form) to demand; to coerce||to want; to need; to ask for; will; shall; about to; need to; should; if (same as 要是[yào shi]); (bound form) important";"坚决 (resolute; jiānjué; hsk5)";"firm; resolute; determined";"维护 (defend; wéihù; hsk6)";"to defend/to safeguard/to protect/to uphold/to maintain";"国家 (country; guójiā; hsk3|stront1)";"country; nation; state/CL:个[gè]";"的 (of; de||dī||dí||dì; also pr. dì or di in poetry and songs; hsk1)";"of; ~'s (possessive particle); (used after an attribute); (used to form a nominal expression); (used at the end of a declarative sentence for emphasis); a cab (abbr. for 的士[dī shì])||really and truly||(bound form) bull's-eye; target";"利益 (benefit; lìyì; hsk5)";"benefit/(in sb's) interest/CL:个[gè]"
"他的话不见得是真的。";"tā dehuà bùjiànde shì zhēnde.";"His words may not necessarily be true.";"他 (he; tā; hsk1)";"he; him (used for either sex when the sex is unknown or unimportant)/(used before sb's name for emphasis)/(used as a meaningless mock object)/(literary) other";"的话 (if; dehuà; non-hsk)";"if (coming after a conditional clause)";"不见得 (not necessarily; bùjiànde; hsk5)";"not necessarily/not likely";"是 (to be; shì; hsk1)";"to be (followed by substantives only); correct; right; true; (respectful acknowledgement of a command) very well; (adverb for emphatic assertion)";"真的 (really; zhēnde; non-hsk)";"really; truly; indeed/real; true; genuine/(math.) proper"
"客人们陆续到达。";"kèrén men lùxù dàodá.";"The guests arrived one after the other.";"客人 (visitor; kèrén; hsk3|stront1)";"visitor/guest/customer/client/CL:位[wèi]";"们 (plural; men; non-hsk)";"plural marker for pronouns, and nouns referring to individuals";"陆续 (successively; lùxù; hsk5)";"in turn/successively/one after the other/bit by bit";"到达 (arrive; dàodá; hsk5)";"to reach; to arrive"
"他挥了挥手告别。";"tāhuī le huīshǒugàobié.";"He waved his hand to say goodbye.";"他挥 (tāhuī; non-hsk)";"No definition found";"了 (finish; le||liǎo||liǎo; hsk1)";"(completed action marker); (modal particle indicating change of state, situation now); (modal particle intensifying preceding clause)||to finish; to achieve; variant of 了[liǎo]; to understand clearly||(of eyes) bright; clear-sighted; to understand clearly";"挥手告别 (huīshǒugàobié; non-hsk)";"No definition found"
"他是象棋高手。";"tā shì xiàngqí gāoshǒu.";"He is a Chinese chess expert.";"他 (he; tā; hsk1)";"he; him (used for either sex when the sex is unknown or unimportant)/(used before sb's name for emphasis)/(used as a meaningless mock object)/(literary) other";"是 (to be; shì; hsk1)";"to be (followed by substantives only); correct; right; true; (respectful acknowledgement of a command) very well; (adverb for emphatic assertion)";"象棋 (Chinese chess; xiàngqí; hsk5)";"Chinese chess/CL:副[fù]";"高手 (expert; gāoshǒu; non-hsk)";"expert/past master/dab hand"
"这个箱子的重量超过了限制。";"zhège xiāngzi de zhòngliàng chāoguò le xiànzhì.";"The weight of this box exceeds the limit.";"这个 (zhège; non-hsk)";"(pronoun) this/(adjective) this";"箱子 (suitcase; xiāngzi; non-hsk)";"suitcase/chest/box/case/trunk/CL:只[zhī],个[gè]";"的 (of; de||dī||dí||dì; also pr. dì or di in poetry and songs; hsk1)";"of; ~'s (possessive particle); (used after an attribute); (used to form a nominal expression); (used at the end of a declarative sentence for emphasis); a cab (abbr. for 的士[dī shì])||really and truly||(bound form) bull's-eye; target";"重量 (weight; zhòngliàng; hsk5)";"weight/CL:个[gè]";"超过 (surpass; chāoguò; hsk4|stront1)";"to surpass/to exceed/to outstrip";"了 (finish; le||liǎo||liǎo; hsk1)";"(completed action marker); (modal particle indicating change of state, situation now); (modal particle intensifying preceding clause)||to finish; to achieve; variant of 了[liǎo]; to understand clearly||(of eyes) bright; clear-sighted; to understand clearly";"限制 (restrict; xiànzhì; hsk5|stront2)";"to restrict/to limit/to confine/restriction/limit/CL:个[gè]"
"爱惜资源是我们的责任。";"àixī zīyuán shì wǒmen de zérèn.";"Treasure resources is our responsibility.";"爱惜 (cherish; àixī; hsk5)";"to cherish/to treasure/to use sparingly";"资源 (resource; zīyuán; hsk5|stront1)";"natural resource (such as water or minerals); resource (such as manpower or tourism); Ziyuan county in Guilin 桂林[Guì lín], Guangxi";"是 (to be; shì; hsk1)";"to be (followed by substantives only); correct; right; true; (respectful acknowledgement of a command) very well; (adverb for emphatic assertion)";"我们 (we; wǒmen; hsk1)";"we; us; ourselves; our";"的 (of; de||dī||dí||dì; also pr. dì or di in poetry and songs; hsk1)";"of; ~'s (possessive particle); (used after an attribute); (used to form a nominal expression); (used at the end of a declarative sentence for emphasis); a cab (abbr. for 的士[dī shì])||really and truly||(bound form) bull's-eye; target";"责任 (responsibility; zérèn; hsk4|stront1)";"responsibility/blame/duty/CL:个[gè]"
"我们急忙赶到现场。";"wǒmen jímáng gǎndào xiànchǎng.";"We hurried to the scene.";"我们 (we; wǒmen; hsk1)";"we; us; ourselves; our";"急忙 (hastily; jímáng; hsk5)";"hastily";"赶到 (hurry; gǎndào; non-hsk)";"to hurry (to some place)";"现场 (the scene; xiànchǎng; hsk6)";"the scene (of a crime, accident etc)/(on) the spot/(at) the site"
"这朵云像一只飞翔的鸟。";"zhèduǒ yúnxiàng yīzhī fēixiáng de niǎo.";"This cloud looks like a flying bird.";"这朵 (zhèduǒ; non-hsk)";"No definition found";"云像 (yúnxiàng; non-hsk)";"No definition found";"一只 (yīzhī; non-hsk)";"No definition found";"飞翔 (soar; fēixiáng; hsk6)";"to circle in the air/to soar";"的 (of; de||dī||dí||dì; also pr. dì or di in poetry and songs; hsk1)";"of; ~'s (possessive particle); (used after an attribute); (used to form a nominal expression); (used at the end of a declarative sentence for emphasis); a cab (abbr. for 的士[dī shì])||really and truly||(bound form) bull's-eye; target";"鸟 (bird; niǎo; hsk3)";"bird; ""bird"" radical in Chinese characters (Kangxi radical 196); (dialect) to pay attention to; (intensifier) damned; goddamn; CL:只[zhī],群[qún]"
