"他写了一个演讲提纲。";"tā xiě le yīgè yǎnjiǎng tígāng.";"He wrote an outline for the speech.";"他 (he; tā; hsk1)";"he; him (used for either sex when the sex is unknown or unimportant)/(used before sb's name for emphasis)/(used as a meaningless mock object)/(literary) other";"写 (write; xiě; hsk1)";"to write";"了 (finish; le||liǎo||liǎo; hsk1)";"(completed action marker); (modal particle indicating change of state, situation now); (modal particle intensifying preceding clause)||to finish; to achieve; variant of 了[liǎo]; to understand clearly||(of eyes) bright; clear-sighted; to understand clearly";"一个 (yīgè; non-hsk)";"No definition found";"演讲 (lecture; yǎnjiǎng; hsk5)";"to give a lecture; to make a speech";"提纲 (outline; tígāng; hsk5)";"outline/synopsis/notes"
"他在谈判中处于有利地位。";"tā zài tánpàn zhōng chǔyú yǒulì dìwèi.";"He is in a favorable position in the negotiations.";"他 (he; tā; hsk1)";"he; him (used for either sex when the sex is unknown or unimportant)/(used before sb's name for emphasis)/(used as a meaningless mock object)/(literary) other";"在 (exist; zài; hsk1)";"to exist; to be alive/(of sb or sth) to be (located) at/(used before a verb to indicate an action in progress)";"谈判 (negotiate; tánpàn; hsk5)";"to negotiate/negotiation/talks/conference/CL:个[gè]";"中 (middle; zhōng||zhōng||zhòng; non-hsk)";"among; in; middle; center; while (doing sth); during; (dialect) OK; all right||to hit (the mark); to be hit by; to suffer; to win (a prize, a lottery); surname Zhong||within; China; Chinese";"处于 (be in; chǔyú; non-hsk)";"to be in (some state, position, or condition)";"有利 (advantageous; yǒulì; hsk5)";"advantageous; favorable";"地位 (position; dìwèi; hsk5)";"position/status/place/CL:个[gè]"
"这次失败等于一次教训。";"zhècì shībài děngyú yīcì jiàoxun.";"This failure is tantamount to a lesson.";"这次 (zhècì; non-hsk)";"No definition found";"失败 (fail; shībài; hsk4)";"to be defeated/to lose/to fail (e.g. experiments)/failure/defeat/CL:次[cì]";"等于 (equal to; děngyú; hsk5)";"to equal/to be tantamount to";"一次 (yīcì; non-hsk)";"first/first time/once/(math.) linear (of degree one)";"教训 (provide guidance; jiàoxun; hsk5)";"to provide guidance; to lecture sb; to upbraid/a talking-to; a bitter lesson/CL:番[fān],顿[dùn]"
"他对宠物非常疼爱。";"tā duì chǒngwù fēicháng téngài.";"He is very fond of his pet.";"他 (he; tā; hsk1)";"he; him (used for either sex when the sex is unknown or unimportant)/(used before sb's name for emphasis)/(used as a meaningless mock object)/(literary) other";"对 (opposite; duì; hsk2)";"right; correct/towards; at; for/concerning; regarding/to treat (sb a certain way)/to face/(bound form) opposite; facing; matching/to match together; to adjust/to fit; to suit/to answer; to reply/to add; to pour in (a fluid)/to check; to compare/classifier: couple; pair";"宠物 (house pet; chǒngwù; hsk5)";"house pet";"非常 (very; fēicháng; hsk2)";"very; really/unusual; extraordinary";"疼爱 (love dearly; téngài; hsk5)";"to love dearly"
"我们不应该纠缠于是非之间。";"wǒmen bù yīnggāi jiūchán yúshì fēi zhījiān.";"We should not be entangled in right and wrong.";"我们 (we; wǒmen; hsk1)";"we; us; ourselves; our";"不 (no; bù; hsk1)";"no; not so/(bound form) not; un-";"应该 (should; yīnggāi; hsk3)";"ought to/should/must";"纠缠 (jiūchán; non-hsk)";"to be in a tangle/to nag";"于是 (thereupon; yúshì; hsk4)";"thereupon; as a result; consequently; thus; hence";"非 (not; fēi; hsk5)";"abbr. for 非洲[Fēi zhōu], Africa; to not be; not; wrong; incorrect; non-; un-; in-; de-; to reproach; to blame; (coll.) to insist on; simply must";"之间 (between; zhījiān; non-hsk)";"(after a noun) between; among; amid/(used after certain bisyllabic words to form expressions indicating a short period of time, e.g. 彈指之間|弹指之间[tán zhǐ zhī jiān])"
"请关闭窗户。";"qǐng guānbì chuānghù.";"Please close the window.";"请 (ask; qǐng; hsk1)";"to ask/to invite/please (do sth)/to treat (to a meal etc)/to request";"关闭 (to close; guānbì; hsk5)";"to close; to shut (a window etc)/(of a shop, school etc) to shut down";"窗户 (window; chuānghu; hsk4)";"window/CL:个[gè],扇[shàn]"
"这个组的成员都是很优秀的。";"zhège zǔ de chéngyuán dōu shì hěn yōuxiù de.";"The members of this group are all excellent.";"这个 (zhège; non-hsk)";"(pronoun) this/(adjective) this";"组 (group; zǔ; hsk5)";"to form; to organize; group; team; classifier for sets, series, groups of people, batteries; surname Zu";"的 (of; de||dī||dí||dì; also pr. dì or di in poetry and songs; hsk1)";"of; ~'s (possessive particle); (used after an attribute); (used to form a nominal expression); (used at the end of a declarative sentence for emphasis); a cab (abbr. for 的士[dī shì])||really and truly||(bound form) bull's-eye; target";"成员 (member; chéngyuán; hsk6)";"member";"都 (capital city; dū||dōu||dū; hsk1)";"both; entirely; (used for emphasis) even; already; (not) at all||capital city; metropolis; surname Du||all";"是 (to be; shì; hsk1)";"to be (followed by substantives only); correct; right; true; (respectful acknowledgement of a command) very well; (adverb for emphatic assertion)";"很 (very; hěn; hsk1)";"(adverb of degree)/quite/very/awfully";"优秀 (outstanding; yōuxiù; hsk4|stront1)";"outstanding; excellent";"的 (of; de||dī||dí||dì; also pr. dì or di in poetry and songs; hsk1)";"of; ~'s (possessive particle); (used after an attribute); (used to form a nominal expression); (used at the end of a declarative sentence for emphasis); a cab (abbr. for 的士[dī shì])||really and truly||(bound form) bull's-eye; target"
"他滴了一滴墨水在纸上。";"tādī le yīdī mòshuǐ zài zhǐ shàng.";"He dripped a drop of ink on the paper.";"他滴 (tādī; non-hsk)";"No definition found";"了 (finish; le||liǎo||liǎo; hsk1)";"(completed action marker); (modal particle indicating change of state, situation now); (modal particle intensifying preceding clause)||to finish; to achieve; variant of 了[liǎo]; to understand clearly||(of eyes) bright; clear-sighted; to understand clearly";"一滴 (yīdī; non-hsk)";"No definition found";"墨水 (ink; mòshuǐ; non-hsk)";"ink/CL:瓶[píng]";"在 (exist; zài; hsk1)";"to exist; to be alive/(of sb or sth) to be (located) at/(used before a verb to indicate an action in progress)";"纸 (paper; zhǐ; non-hsk)";"paper; classifier for documents, letter etc; CL:张[zhāng],沓[dá]";"上 (above; shǎng||shàng; hsk1)";"used in 上聲|上声[shǎng shēng]||(bound form) up; upper; above; previous; first (of multiple parts); to climb; to get onto; to go up; to attend (class or university); (directional complement) up; (noun suffix) on; above"
"请专心听讲。";"qǐng zhuānxīn tīngjiǎng.";"Please focus on listening to the lecture.";"请 (ask; qǐng; hsk1)";"to ask/to invite/please (do sth)/to treat (to a meal etc)/to request";"专心 (focus; zhuānxīn; hsk5|stront1)";"to focus one's attention; to concentrate on (doing sth)";"听讲 (attend lecture; tīngjiǎng; non-hsk)";"to attend a lecture/to listen to a talk"
"他的成果得到了老板的认可。";"tā de chéngguǒ dédào le lǎobǎn de rènkě.";"His achievements have been recognized by the boss.";"他 (he; tā; hsk1)";"he; him (used for either sex when the sex is unknown or unimportant)/(used before sb's name for emphasis)/(used as a meaningless mock object)/(literary) other";"的 (of; de||dī||dí||dì; also pr. dì or di in poetry and songs; hsk1)";"of; ~'s (possessive particle); (used after an attribute); (used to form a nominal expression); (used at the end of a declarative sentence for emphasis); a cab (abbr. for 的士[dī shì])||really and truly||(bound form) bull's-eye; target";"成果 (achievement; chéngguǒ; hsk5)";"result/achievement/gain/profit/CL:个[gè]";"得到 (obtain; dédào; non-hsk)";"to get; to obtain; to receive";"了 (finish; le||liǎo||liǎo; hsk1)";"(completed action marker); (modal particle indicating change of state, situation now); (modal particle intensifying preceding clause)||to finish; to achieve; variant of 了[liǎo]; to understand clearly||(of eyes) bright; clear-sighted; to understand clearly";"老板 (boss; lǎobǎn; hsk5|stront1|weeb1)";"boss; business proprietor; Robam (brand); CL:个[gè]";"的 (of; de||dī||dí||dì; also pr. dì or di in poetry and songs; hsk1)";"of; ~'s (possessive particle); (used after an attribute); (used to form a nominal expression); (used at the end of a declarative sentence for emphasis); a cab (abbr. for 的士[dī shì])||really and truly||(bound form) bull's-eye; target";"认可 (approve; rènkě; hsk6)";"to approve/approval/acknowledgment/OK"
"报社的编辑很忙。";"bàoshè de biānjí hěn máng.";"The editors at the newspaper company are very busy.";"报社 (newspaper; bàoshè; hsk5)";"newspaper (i.e. a company)/CL:家[jiā]";"的 (of; de||dī||dí||dì; also pr. dì or di in poetry and songs; hsk1)";"of; ~'s (possessive particle); (used after an attribute); (used to form a nominal expression); (used at the end of a declarative sentence for emphasis); a cab (abbr. for 的士[dī shì])||really and truly||(bound form) bull's-eye; target";"编辑 (edit; biānjí; hsk5)";"to edit/to compile/editor/compiler";"很 (very; hěn; hsk1)";"(adverb of degree)/quite/very/awfully";"忙 (busy; máng; hsk2)";"busy/hurriedly/to hurry/to rush"
"他的帽子戴歪了。";"tā de màozi dài wāi le.";"His hat is worn askew.";"他 (he; tā; hsk1)";"he; him (used for either sex when the sex is unknown or unimportant)/(used before sb's name for emphasis)/(used as a meaningless mock object)/(literary) other";"的 (of; de||dī||dí||dì; also pr. dì or di in poetry and songs; hsk1)";"of; ~'s (possessive particle); (used after an attribute); (used to form a nominal expression); (used at the end of a declarative sentence for emphasis); a cab (abbr. for 的士[dī shì])||really and truly||(bound form) bull's-eye; target";"帽子 (label; màozi; hsk3)";"hat/cap/(fig.) label/bad name/CL:顶[dǐng]";"戴 (put on; dài; hsk4)";"to put on or wear (glasses, hat, gloves etc); to respect; to bear; to support; surname Dai";"歪 (askew; wāi||wǎi; hsk5)";"askew; at a crooked angle; devious; noxious; (coll.) to lie on one's side||to sprain (one's ankle) (Tw)";"了 (finish; le||liǎo||liǎo; hsk1)";"(completed action marker); (modal particle indicating change of state, situation now); (modal particle intensifying preceding clause)||to finish; to achieve; variant of 了[liǎo]; to understand clearly||(of eyes) bright; clear-sighted; to understand clearly"
"他缺乏常识。";"tā quēfá chángshí.";"He lacks general knowledge.";"他 (he; tā; hsk1)";"he; him (used for either sex when the sex is unknown or unimportant)/(used before sb's name for emphasis)/(used as a meaningless mock object)/(literary) other";"缺乏 (lack; quēfá; hsk5)";"to lack; to be short of";"常识 (common sense; chángshí; hsk5)";"common sense/general knowledge/CL:门[mén]"
"公司目前处于发展阶段。";"gōngsī mùqián chǔyú fāzhǎn jiēduàn.";"The company is currently in the development stage.";"公司 (company; gōngsī; hsk2|stront1)";"company; firm; corporation/CL:家[jiā]";"目前 (current; mùqián; hsk5)";"at the present time/currently";"处于 (be in; chǔyú; non-hsk)";"to be in (some state, position, or condition)";"发展 (development; fāzhǎn; hsk4)";"development/growth/to develop/to grow/to expand";"阶段 (stage; jiēduàn; hsk5)";"stage/section/phase/period/CL:个[gè]"
"医生诊断出了她的病情。";"yīshēng zhěnduàn chū le tā de bìngqíng.";"The doctor diagnosed her condition.";"医生 (doctor; yīshēng; hsk1)";"doctor/CL:个[gè],位[wèi],名[míng]";"诊断 (diagnose; zhěnduàn; hsk5)";"to diagnose";"出 (go out; chū; hsk2)";"to go out; to come out; to arise; to occur; to produce; to yield; to go beyond; to exceed; (used after a verb to indicate an outward direction or a positive result); classifier for dramas, plays, operas etc";"了 (finish; le||liǎo||liǎo; hsk1)";"(completed action marker); (modal particle indicating change of state, situation now); (modal particle intensifying preceding clause)||to finish; to achieve; variant of 了[liǎo]; to understand clearly||(of eyes) bright; clear-sighted; to understand clearly";"她 (she; tā; hsk1)";"she";"的 (of; de||dī||dí||dì; also pr. dì or di in poetry and songs; hsk1)";"of; ~'s (possessive particle); (used after an attribute); (used to form a nominal expression); (used at the end of a declarative sentence for emphasis); a cab (abbr. for 的士[dī shì])||really and truly||(bound form) bull's-eye; target";"病情 (illness state; bìngqíng; non-hsk)";"state of an illness/patient's condition"
"金凌总之是个孝顺的孩子。";"jīnlíng zǒngzhī shì gè xiàoshùn de háizi.";"In a word, Jin Ling is a filial child.";"金凌 (jīnlíng; non-hsk)";"No definition found";"总之 (in short; zǒngzhī; hsk5)";"in a word/in short/in brief";"是 (to be; shì; hsk1)";"to be (followed by substantives only); correct; right; true; (respectful acknowledgement of a command) very well; (adverb for emphatic assertion)";"个 (individual; gě||gè; hsk1)";"used in 自個兒|自个儿[zì gě r]||(classifier used before a noun that has no specific classifier); (bound form) individual";"孝顺 (filial; xiàoshùn; hsk5)";"filial/dutiful/devoted to one's parents (and grandparents etc)/to show filial piety towards (an older family member)/filial piety";"的 (of; de||dī||dí||dì; also pr. dì or di in poetry and songs; hsk1)";"of; ~'s (possessive particle); (used after an attribute); (used to form a nominal expression); (used at the end of a declarative sentence for emphasis); a cab (abbr. for 的士[dī shì])||really and truly||(bound form) bull's-eye; target";"孩子 (child; háizi; hsk2)";"child"
"我喜欢单独散步。";"wǒ xǐhuan dāndú sànbù.";"I like to take a walk alone.";"我 (I; wǒ; hsk1)";"me; my; I";"喜欢 (like; xǐhuan; hsk1)";"to like; to be fond of";"单独 (alone; dāndú; hsk5)";"alone/by oneself/on one's own";"散步 (walk; sànbù; hsk4)";"to take a walk; to go for a walk"
"请随时提问。";"qǐng suíshí tíwèn.";"Please feel free to ask questions.";"请 (ask; qǐng; hsk1)";"to ask/to invite/please (do sth)/to treat (to a meal etc)/to request";"随时 (at any time; suíshí; hsk5)";"at any time; at all times/at the right time; whenever necessary";"提问 (question; tíwèn; hsk5)";"to question; to quiz; to grill"
"她喜欢用玻璃壶泡茶。";"tā xǐhuan yòng bōli hú pàochá.";"She likes to make tea with a glass teapot.";"她 (she; tā; hsk1)";"she";"喜欢 (like; xǐhuan; hsk1)";"to like; to be fond of";"用 (to use; yòng; hsk3)";"to use/to employ/to have to/to eat or drink/expense or outlay/usefulness/hence/therefore";"玻璃 (glass; bōli; hsk5)";"glass/CL:张[zhāng],块[kuài]/(slang) male homosexual";"壶 (pot; hú; hsk5)";"pot/classifier for bottled liquid";"泡茶 (make tea; pàochá; stront1)";"to make tea"
"他采取了预防措施。";"tā cǎiqǔ le yùfángcuòshī.";"He took precautionary measures.";"他 (he; tā; hsk1)";"he; him (used for either sex when the sex is unknown or unimportant)/(used before sb's name for emphasis)/(used as a meaningless mock object)/(literary) other";"采取 (to adopt; cǎiqǔ; hsk5)";"to adopt or carry out (measures, policies, course of action)/to take";"了 (finish; le||liǎo||liǎo; hsk1)";"(completed action marker); (modal particle indicating change of state, situation now); (modal particle intensifying preceding clause)||to finish; to achieve; variant of 了[liǎo]; to understand clearly||(of eyes) bright; clear-sighted; to understand clearly";"预防措施 (yùfángcuòshī; non-hsk)";"protective step/protective measure"
"请等待领导的批准。";"qǐng děngdài lǐngdǎo de pīzhǔn.";"Please wait for the leader's approval.";"请 (ask; qǐng; hsk1)";"to ask/to invite/please (do sth)/to treat (to a meal etc)/to request";"等待 (wait; děngdài; hsk5)";"to wait; to wait for";"领导 (lead; lǐngdǎo; hsk5)";"lead/leading/to lead/leadership/leader/CL:位[wèi],个[gè]";"的 (of; de||dī||dí||dì; also pr. dì or di in poetry and songs; hsk1)";"of; ~'s (possessive particle); (used after an attribute); (used to form a nominal expression); (used at the end of a declarative sentence for emphasis); a cab (abbr. for 的士[dī shì])||really and truly||(bound form) bull's-eye; target";"批准 (approve; pīzhǔn; hsk5)";"to approve; to ratify"
"他从事外交工作。";"tā cóngshì wàijiāo gōngzuò.";"He works in diplomacy.";"他 (he; tā; hsk1)";"he; him (used for either sex when the sex is unknown or unimportant)/(used before sb's name for emphasis)/(used as a meaningless mock object)/(literary) other";"从事 (to engage in; cóngshì; hsk5)";"to go for/to engage in/to undertake/to deal with/to handle/to do";"外交 (diplomacy; wàijiāo; hsk5)";"diplomacy/diplomatic/foreign affairs/CL:个[gè]";"工作 (work; gōngzuò; hsk1)";"to work/(of a machine) to operate/job/work/task/CL:个[gè],份[fèn],项[xiàng]"
"他自愿承担了这个任务。";"tā zìyuàn chéngdān le zhège rènwu.";"He voluntarily took on this task.";"他 (he; tā; hsk1)";"he; him (used for either sex when the sex is unknown or unimportant)/(used before sb's name for emphasis)/(used as a meaningless mock object)/(literary) other";"自愿 (voluntary; zìyuàn; hsk5)";"voluntary";"承担 (undertake; chéngdān; hsk5)";"to undertake/to assume (responsibility etc)";"了 (finish; le||liǎo||liǎo; hsk1)";"(completed action marker); (modal particle indicating change of state, situation now); (modal particle intensifying preceding clause)||to finish; to achieve; variant of 了[liǎo]; to understand clearly||(of eyes) bright; clear-sighted; to understand clearly";"这个 (zhège; non-hsk)";"(pronoun) this/(adjective) this";"任务 (mission; rènwu; hsk4)";"mission; assignment; task; duty; role/CL:项[xiàng],个[gè]"
"他送给她一条丝绸围巾。";"tā sònggěi tā yītiáo sīchóu wéijīn.";"He gave her a silk scarf.";"他 (he; tā; hsk1)";"he; him (used for either sex when the sex is unknown or unimportant)/(used before sb's name for emphasis)/(used as a meaningless mock object)/(literary) other";"送给 (give; sònggěi; non-hsk)";"to send/to give as a present";"她 (she; tā; hsk1)";"she";"一条 (yītiáo; non-hsk)";"No definition found";"丝绸 (silk; sīchóu; hsk5)";"silk cloth/silk";"围巾 (scarf; wéijīn; hsk5|stront1)";"scarf/shawl/CL:条[tiáo]"
"成为企业家需要冒险精神。";"chéngwéi qǐyèjiā xūyào màoxiǎn jīngshén.";"Becoming an entrepreneur requires a spirit of adventure.";"成为 (become; chéngwéi; hsk4|stront2)";"to become; to turn into";"企业家 (entrepreneur; qǐyèjiā; stront1)";"entrepreneur";"需要 (need; xūyào; hsk3|stront1)";"to need; to want; to demand; to require/needs";"冒险 (take risks; màoxiǎn; hsk5|stront2)";"to take risks/to take chances/foray/adventure";"精神 (vigor; jīngshén||jīngshen; hsk5|stront2)";"spirit; mind; consciousness; thought; mental; psychological; essence; gist; vitality; spirited; good-looking; CL:个[gè]||vigor"
"他扛着枪冲向敌人。";"tā kángzhe qiāng chōngxiàng dírén.";"He charged at the enemy with a gun.";"他 (he; tā; hsk1)";"he; him (used for either sex when the sex is unknown or unimportant)/(used before sb's name for emphasis)/(used as a meaningless mock object)/(literary) other";"扛着 (kángzhe; non-hsk)";"No definition found";"枪 (gun; qiāng; hsk5|stront1)";"gun; firearm; rifle; spear; thing with shape or function similar to a gun; to substitute for another person in a test; to knock; classifier for rifle shots; surname Qiang; CL:支[zhī],把[bǎ],杆[gǎn],条[tiáo],枝[zhī]";"冲向 (chōngxiàng; non-hsk)";"to charge into";"敌人 (enemy; dírén; hsk5)";"enemy/CL:个[gè]"
"他赞成我的观点。";"tā zànchéng wǒ de guāndiǎn.";"He endorses my point of view.";"他 (he; tā; hsk1)";"he; him (used for either sex when the sex is unknown or unimportant)/(used before sb's name for emphasis)/(used as a meaningless mock object)/(literary) other";"赞成 (approve; zànchéng; hsk5)";"to approve/to endorse/(literary) to assist";"我 (I; wǒ; hsk1)";"me; my; I";"的 (of; de||dī||dí||dì; also pr. dì or di in poetry and songs; hsk1)";"of; ~'s (possessive particle); (used after an attribute); (used to form a nominal expression); (used at the end of a declarative sentence for emphasis); a cab (abbr. for 的士[dī shì])||really and truly||(bound form) bull's-eye; target";"观点 (viewpoint; guāndiǎn; hsk5|stront2)";"point of view/viewpoint/standpoint/CL:个[gè]"
"这条胡同儿很有特色。";"zhè tiáo hútòng r hěn yǒu tèsè.";"This alley has a lot of character.";"这 (this; zhè; commonly pr. zhèi esp. in Beijing; non-hsk)";"(pronoun) this; these/(bound form) this; the (followed by a noun)/(bound form) this";"条 (strip; tiáo; hsk3)";"strip/item/article/clause (of law or treaty)/classifier for long thin things (ribbon, river, road, trousers etc)";"胡同 (alley; hútòng; hsk5|stront1)";"lane; alley; CL:条[tiáo]";"儿 (person/diminutive; ér||r; non-hsk)";"child; son||non-syllabic diminutive suffix; retroflex final";"很 (very; hěn; hsk1)";"(adverb of degree)/quite/very/awfully";"有 (have; yǒu; hsk1)";"to have; there is/(bound form) having; with; -ful; -ed; -al (as in 有意[yǒu yì] intentional)";"特色 (characteristic; tèsè; hsk5|stront1|stront2)";"characteristic/distinguishing feature or quality"
"他在录音室录音。";"tā zài lùyīnshì lùyīn.";"He is recording in the recording studio.";"他 (he; tā; hsk1)";"he; him (used for either sex when the sex is unknown or unimportant)/(used before sb's name for emphasis)/(used as a meaningless mock object)/(literary) other";"在 (exist; zài; hsk1)";"to exist; to be alive/(of sb or sth) to be (located) at/(used before a verb to indicate an action in progress)";"录音室 (lùyīnshì; non-hsk)";"No definition found";"录音 (record; lùyīn; hsk5|stront1)";"to record (sound)/sound recording/CL:个[gè]"
"这幅画的色彩很突出。";"zhèfú huà de sècǎi hěn tūchū.";"The colors in this painting are very prominent.";"这幅 (zhè fú; non-hsk)";"No definition found";"画 (to draw; huà; hsk3)";"to draw; to paint/picture; painting (CL:幅[fú],张[zhāng])/to draw (a line) (variant of 划[huà])/stroke of a Chinese character (variant of 划[huà])/(calligraphy) horizontal stroke (variant of 划[huà])";"的 (of; de||dī||dí||dì; also pr. dì or di in poetry and songs; hsk1)";"of; ~'s (possessive particle); (used after an attribute); (used to form a nominal expression); (used at the end of a declarative sentence for emphasis); a cab (abbr. for 的士[dī shì])||really and truly||(bound form) bull's-eye; target";"色彩 (coloring; sècǎi; hsk5)";"tint; coloring; coloration/(fig.) flavor; character";"很 (very; hěn; hsk1)";"(adverb of degree)/quite/very/awfully";"突出 (prominent; tūchū; hsk5)";"prominent/outstanding/to give prominence to/to protrude/to project"
"金子轩的总裁风范深受员工尊敬。";"jīnzi xuān de zǒngcái fēngfàn shēnshòu yuángōng zūnjìng.";"Jin Zixuan's chairman style is highly respected by the employees.";"金子 (jīnzǐ||jīnzi; non-hsk)";"Kaneko (Japanese surname)||gold";"轩 (xuān; non-hsk)";"pavilion with a view; high; tall; high fronted, curtained carriage (old); surname Xuan";"的 (of; de||dī||dí||dì; also pr. dì or di in poetry and songs; hsk1)";"of; ~'s (possessive particle); (used after an attribute); (used to form a nominal expression); (used at the end of a declarative sentence for emphasis); a cab (abbr. for 的士[dī shì])||really and truly||(bound form) bull's-eye; target";"总裁 (chairman; zǒngcái; hsk5)";"chairman/director-general (of a company etc)";"风范 (fēngfàn; non-hsk)";"air/manner/model/paragon/demeanor";"深受 (shēnshòu; non-hsk)";"to receive in no small measure";"员工 (staff; yuángōng; hsk5|stront1)";"staff; personnel; employee";"尊敬 (respect; zūnjìng; hsk5)";"to respect; to revere; to esteem/honorable; distinguished (used on formal occasions before a term of address)"
"通过实践可以更好地体会。";"tōngguò shíjiàn kěyǐ gēnghǎo dì tǐhuì.";"You can better understand through practice.";"通过 (to pass through; tōngguò; hsk4)";"to pass through; to get through/to adopt (a resolution); to pass (legislation)/to pass (a test)/by means of; through; via";"实践 (practice; shíjiàn; hsk5)";"practice/to put into practice/to live up to (a promise)/to carry out (a project)";"可以 (can; kěyǐ; hsk2)";"can/may/possible/able to/not bad/pretty good";"更好 (gēnghǎo; non-hsk)";"No definition found";"地 (-ly; de||dì; hsk3)";"-ly; structural particle: used before a verb or adjective, linking it to preceding modifying adverbial adjunct||earth; ground; field; place; land; CL:片[piàn]";"体会 (realize; tǐhuì; hsk5)";"to know from experience/to learn through experience/to realize/understanding/experience"
