"商业合作是双方互利的。";"shāngyè hézuò shì shuāngfāng hùlì de.";"Business cooperation is mutually beneficial.";"商业 (business; shāngyè; hsk5|stront1)";"business/trade/commerce";"合作 (cooperate; hézuò; hsk5|stront1|stront2)";"to cooperate; to collaborate; to work together";"是 (to be; shì; hsk1)";"to be (followed by substantives only); correct; right; true; (respectful acknowledgement of a command) very well; (adverb for emphatic assertion)";"双方 (both sides; shuāngfāng; hsk5)";"bilateral/both sides/both parties involved";"互利 (hùlì; non-hsk)";"mutually beneficial";"的 (of; de||dī||dí||dì; also pr. dì or di in poetry and songs; hsk1)";"of; ~'s (possessive particle); (used after an attribute); (used to form a nominal expression); (used at the end of a declarative sentence for emphasis); a cab (abbr. for 的士[dī shì])||really and truly||(bound form) bull's-eye; target"
"他们彼此信任。";"tāmen bǐcǐ xìnrèn.";"They trust each other.";"他们 (they; tāmen; non-hsk)";"they; them";"彼此 (each other; bǐcǐ; hsk5)";"each other; one another";"信任 (trust; xìnrèn; hsk5)";"to trust/to have confidence in"
"他的身体很弱。";"tā de shēntǐ hěn ruò.";"His body is very weak.";"他 (he; tā; hsk1)";"he; him (used for either sex when the sex is unknown or unimportant)/(used before sb's name for emphasis)/(used as a meaningless mock object)/(literary) other";"的 (of; de||dī||dí||dì; also pr. dì or di in poetry and songs; hsk1)";"of; ~'s (possessive particle); (used after an attribute); (used to form a nominal expression); (used at the end of a declarative sentence for emphasis); a cab (abbr. for 的士[dī shì])||really and truly||(bound form) bull's-eye; target";"身体 (body; shēntǐ; hsk2|stront1)";"the body/one's health";"很 (very; hěn; hsk1)";"(adverb of degree)/quite/very/awfully";"弱 (weak; ruò; hsk5)";"weak; feeble/young/inferior; not as good as/(following a decimal or fraction) slightly less than"
"观众开始鼓掌。";"guānzhòng kāishǐ gǔzhǎng.";"The audience started to applaud.";"观众 (spectators; guānzhòng; hsk4)";"spectators; audience; visitors (to an exhibition etc)";"开始 (begin; kāishǐ; hsk2)";"to begin/beginning/to start/initial/CL:个[gè]";"鼓掌 (applaud; gǔzhǎng; hsk5)";"to applaud/to clap"
"他无奈地接受了这个事实。";"tā wúnài dì jiēshòu le zhège shìshí.";"He accepted the fact helplessly.";"他 (he; tā; hsk1)";"he; him (used for either sex when the sex is unknown or unimportant)/(used before sb's name for emphasis)/(used as a meaningless mock object)/(literary) other";"无奈 (helpless; wúnài; hsk5)";"to have no alternative/frustrated/exasperated/helpless/(conjunction) but unfortunately";"地 (-ly; de||dì; hsk3)";"-ly; structural particle: used before a verb or adjective, linking it to preceding modifying adverbial adjunct||earth; ground; field; place; land; CL:片[piàn]";"接受 (accept; jiēshòu; hsk4|stront1|stront2)";"to accept (a suggestion, punishment, bribe etc); to acquiesce";"了 (finish; le||liǎo||liǎo; hsk1)";"(completed action marker); (modal particle indicating change of state, situation now); (modal particle intensifying preceding clause)||to finish; to achieve; variant of 了[liǎo]; to understand clearly||(of eyes) bright; clear-sighted; to understand clearly";"这个 (zhège; non-hsk)";"(pronoun) this/(adjective) this";"事实 (fact; shìshí; hsk5)";"fact/CL:个[gè]"
"这个现象逐渐消失。";"zhège xiànxiàng zhújiàn xiāoshī.";"This phenomenon gradually disappeared.";"这个 (zhège; non-hsk)";"(pronoun) this/(adjective) this";"现象 (phenomenon; xiànxiàng; hsk5|stront1)";"phenomenon/CL:个[gè],种[zhǒng]/appearance";"逐渐 (gradually; zhújiàn; hsk5)";"gradually";"消失 (disappear; xiāoshī; hsk5)";"to disappear; to fade away"
"她的能力很综合。";"tā de nénglì hěn zōnghé.";"Her abilities are very comprehensive.";"她 (she; tā; hsk1)";"she";"的 (of; de||dī||dí||dì; also pr. dì or di in poetry and songs; hsk1)";"of; ~'s (possessive particle); (used after an attribute); (used to form a nominal expression); (used at the end of a declarative sentence for emphasis); a cab (abbr. for 的士[dī shì])||really and truly||(bound form) bull's-eye; target";"能力 (capability; nénglì; hsk4|stront1)";"capability/ability/CL:个[gè]";"很 (very; hěn; hsk1)";"(adverb of degree)/quite/very/awfully";"综合 (comprehensive; zōnghé; hsk5)";"comprehensive/composite/synthesized/mixed/to sum up/to integrate/to synthesize"
"他很小气。";"tā hěnxiǎo qì.";"He is very stingy.";"他 (he; tā; hsk1)";"he; him (used for either sex when the sex is unknown or unimportant)/(used before sb's name for emphasis)/(used as a meaningless mock object)/(literary) other";"很小 (hěnxiǎo; non-hsk)";"No definition found";"气 (air; qì; non-hsk)";"gas; air/smell/weather/to make angry; to annoy; to get angry/vital energy; qi"
"姑姑对我很关心。";"gūgu duì wǒ hěn guānxīn.";"My aunt cares a lot about me.";"姑姑 (aunt; gūgu; hsk5)";"paternal aunt/CL:个[gè]";"对 (opposite; duì; hsk2)";"right; correct/towards; at; for/concerning; regarding/to treat (sb a certain way)/to face/(bound form) opposite; facing; matching/to match together; to adjust/to fit; to suit/to answer; to reply/to add; to pour in (a fluid)/to check; to compare/classifier: couple; pair";"我 (I; wǒ; hsk1)";"me; my; I";"很 (very; hěn; hsk1)";"(adverb of degree)/quite/very/awfully";"关心 (concerned; guānxīn; hsk3|stront1)";"to be concerned about; to care about"
"她的资格比你高。";"tā de zīgé bǐ nǐ gāo.";"Her seniority is higher than yours.";"她 (she; tā; hsk1)";"she";"的 (of; de||dī||dí||dì; also pr. dì or di in poetry and songs; hsk1)";"of; ~'s (possessive particle); (used after an attribute); (used to form a nominal expression); (used at the end of a declarative sentence for emphasis); a cab (abbr. for 的士[dī shì])||really and truly||(bound form) bull's-eye; target";"资格 (qualifications; zīgé; hsk5)";"qualifications/seniority";"比 (to compare; bǐ; Taiwan pr. bì in some compounds derived from Classical Chinese; hsk2)";"abbr. for 比利時|比利时[Bǐ lì shí]; to compare; (followed by a noun and adjective) more {adj.} than {noun}; ratio; to gesture; Belgium; Belgian";"你 (you; nǐ; hsk1)";"you (informal, as opposed to courteous 您[nín]); you (Note: In Taiwan, 妳 is used to address females, but in mainland China, it is not commonly used. Instead, 你 is used to address both males and females.)";"高 (high; gāo; hsk2)";"high; tall; above average; loud; your (honorific); surname Gao"
"毕竟我们是朋友。";"bìjìng wǒmen shì péngyou.";"After all, we are friends.";"毕竟 (after all; bìjìng; hsk5)";"after all/all in all/when all is said and done/in the final analysis";"我们 (we; wǒmen; hsk1)";"we; us; ourselves; our";"是 (to be; shì; hsk1)";"to be (followed by substantives only); correct; right; true; (respectful acknowledgement of a command) very well; (adverb for emphatic assertion)";"朋友 (friend; péngyou; hsk1)";"friend/CL:个[gè],位[wèi]"
"这家公司的利润很高。";"zhèjiā gōngsī de lìrùn hěn gāo.";"This company has high profits.";"这家 (zhèjiā; non-hsk)";"No definition found";"公司 (company; gōngsī; hsk2|stront1)";"company; firm; corporation/CL:家[jiā]";"的 (of; de||dī||dí||dì; also pr. dì or di in poetry and songs; hsk1)";"of; ~'s (possessive particle); (used after an attribute); (used to form a nominal expression); (used at the end of a declarative sentence for emphasis); a cab (abbr. for 的士[dī shì])||really and truly||(bound form) bull's-eye; target";"利润 (profits; lìrùn; hsk5)";"profits";"很 (very; hěn; hsk1)";"(adverb of degree)/quite/very/awfully";"高 (high; gāo; hsk2)";"high; tall; above average; loud; your (honorific); surname Gao"
"胃是消化食物的器官。";"wèi shì xiāohuà shíwù de qìguān.";"The stomach is the organ for digesting food.";"胃 (stomach; wèi; hsk5|stront1)";"stomach/CL:个[gè]";"是 (to be; shì; hsk1)";"to be (followed by substantives only); correct; right; true; (respectful acknowledgement of a command) very well; (adverb for emphatic assertion)";"消化 (digest; xiāohuà; hsk5|stront1)";"to digest (food)/(fig.) to absorb (information etc); to assimilate; to process";"食物 (food; shíwù; hsk5|stront1)";"food/CL:种[zhǒng]";"的 (of; de||dī||dí||dì; also pr. dì or di in poetry and songs; hsk1)";"of; ~'s (possessive particle); (used after an attribute); (used to form a nominal expression); (used at the end of a declarative sentence for emphasis); a cab (abbr. for 的士[dī shì])||really and truly||(bound form) bull's-eye; target";"器官 (organ; qìguān; hsk6)";"(physiology) organ; apparatus"
"他是个非常好客的人。";"tā shì gè fēicháng hàokè de rén.";"He is a very hospitable person.";"他 (he; tā; hsk1)";"he; him (used for either sex when the sex is unknown or unimportant)/(used before sb's name for emphasis)/(used as a meaningless mock object)/(literary) other";"是 (to be; shì; hsk1)";"to be (followed by substantives only); correct; right; true; (respectful acknowledgement of a command) very well; (adverb for emphatic assertion)";"个 (individual; gě||gè; hsk1)";"used in 自個兒|自个儿[zì gě r]||(classifier used before a noun that has no specific classifier); (bound form) individual";"非常 (very; fēicháng; hsk2)";"very; really/unusual; extraordinary";"好客 (hospitable; hàokè; hsk5|stront1)";"hospitality/to treat guests well/to enjoy having guests/hospitable/friendly";"的 (of; de||dī||dí||dì; also pr. dì or di in poetry and songs; hsk1)";"of; ~'s (possessive particle); (used after an attribute); (used to form a nominal expression); (used at the end of a declarative sentence for emphasis); a cab (abbr. for 的士[dī shì])||really and truly||(bound form) bull's-eye; target";"人 (person; rén; hsk1)";"person; people/CL:个[gè],位[wèi]"
"他们公开了他们的恋情。";"tāmen gōngkāi le tāmen de liànqíng.";"They made their relationship public.";"他们 (they; tāmen; non-hsk)";"they; them";"公开 (open; gōngkāi; hsk5)";"open; overt; public/to make public; to release";"了 (finish; le||liǎo||liǎo; hsk1)";"(completed action marker); (modal particle indicating change of state, situation now); (modal particle intensifying preceding clause)||to finish; to achieve; variant of 了[liǎo]; to understand clearly||(of eyes) bright; clear-sighted; to understand clearly";"他们 (they; tāmen; non-hsk)";"they; them";"的 (of; de||dī||dí||dì; also pr. dì or di in poetry and songs; hsk1)";"of; ~'s (possessive particle); (used after an attribute); (used to form a nominal expression); (used at the end of a declarative sentence for emphasis); a cab (abbr. for 的士[dī shì])||really and truly||(bound form) bull's-eye; target";"恋情 (liànqíng; non-hsk)";"romantic love"
"他在农场干活儿。";"tā zài nóngchǎng gànhuór.";"He works on the farm.";"他 (he; tā; hsk1)";"he; him (used for either sex when the sex is unknown or unimportant)/(used before sb's name for emphasis)/(used as a meaningless mock object)/(literary) other";"在 (exist; zài; hsk1)";"to exist; to be alive/(of sb or sth) to be (located) at/(used before a verb to indicate an action in progress)";"农场 (nóngchǎng; non-hsk)";"farm";"干活儿 (work; gànhuór; hsk5)";"to work; to be employed"
"这次改革是全面的。";"zhècì gǎigé shì quánmiàn de.";"This reform is all-around.";"这次 (zhècì; non-hsk)";"No definition found";"改革 (reform; gǎigé; hsk5)";"reform/CL:次[cì],种[zhǒng],项[xiàng]/to reform";"是 (to be; shì; hsk1)";"to be (followed by substantives only); correct; right; true; (respectful acknowledgement of a command) very well; (adverb for emphatic assertion)";"全面 (comprehensive; quánmiàn; hsk5)";"all-around/comprehensive/total/overall";"的 (of; de||dī||dí||dì; also pr. dì or di in poetry and songs; hsk1)";"of; ~'s (possessive particle); (used after an attribute); (used to form a nominal expression); (used at the end of a declarative sentence for emphasis); a cab (abbr. for 的士[dī shì])||really and truly||(bound form) bull's-eye; target"
"古代的建筑很有特色。";"gǔdài de jiànzhù hěn yǒu tèsè.";"Ancient architecture is very distinctive.";"古代 (ancient; gǔdài; hsk5)";"ancient times";"的 (of; de||dī||dí||dì; also pr. dì or di in poetry and songs; hsk1)";"of; ~'s (possessive particle); (used after an attribute); (used to form a nominal expression); (used at the end of a declarative sentence for emphasis); a cab (abbr. for 的士[dī shì])||really and truly||(bound form) bull's-eye; target";"建筑 (construct; jiànzhù; hsk5|stront1)";"to construct/building/CL:个[gè]";"很 (very; hěn; hsk1)";"(adverb of degree)/quite/very/awfully";"有 (have; yǒu; hsk1)";"to have; there is/(bound form) having; with; -ful; -ed; -al (as in 有意[yǒu yì] intentional)";"特色 (characteristic; tèsè; hsk5|stront1|stront2)";"characteristic/distinguishing feature or quality"
"神话中的人物很有趣。";"shénhuà zhōng de rénwù hěn yǒuqù.";"The characters in myths are very interesting.";"神话 (myth; shénhuà; hsk5)";"legend/fairy tale/myth/mythology";"中 (middle; zhōng||zhōng||zhòng; non-hsk)";"among; in; middle; center; while (doing sth); during; (dialect) OK; all right||to hit (the mark); to be hit by; to suffer; to win (a prize, a lottery); surname Zhong||within; China; Chinese";"的 (of; de||dī||dí||dì; also pr. dì or di in poetry and songs; hsk1)";"of; ~'s (possessive particle); (used after an attribute); (used to form a nominal expression); (used at the end of a declarative sentence for emphasis); a cab (abbr. for 的士[dī shì])||really and truly||(bound form) bull's-eye; target";"人物 (person; rénwù; hsk5)";"person; personage; figure (esp. sb of importance)/character (in a play, novel etc)/figure painting (as a genre of traditional Chinese painting)";"很 (very; hěn; hsk1)";"(adverb of degree)/quite/very/awfully";"有趣 (interesting; yǒuqù; hsk4|stront1)";"interesting/fascinating/amusing"
"美容手术的风险很大。";"měiróng shǒushù de fēngxiǎn hěndà.";"Cosmetic surgery has a high risk.";"美容 (beautify; měiróng; non-hsk)";"to improve one's appearance (using cosmetics or cosmetic surgery)/to make oneself more attractive/to beautify";"手术 (surgery; shǒushù; hsk5)";"(surgical) operation/surgery/CL:个[gè]";"的 (of; de||dī||dí||dì; also pr. dì or di in poetry and songs; hsk1)";"of; ~'s (possessive particle); (used after an attribute); (used to form a nominal expression); (used at the end of a declarative sentence for emphasis); a cab (abbr. for 的士[dī shì])||really and truly||(bound form) bull's-eye; target";"风险 (risk; fēngxiǎn; hsk5)";"risk; hazard";"很大 (hěndà; non-hsk)";"No definition found"
"他住在一个高级公寓。";"tā zhù zài yīgè gāojí gōngyù.";"He lives in a high-level apartment.";"他 (he; tā; hsk1)";"he; him (used for either sex when the sex is unknown or unimportant)/(used before sb's name for emphasis)/(used as a meaningless mock object)/(literary) other";"住 (live; zhù; hsk1)";"to live/to dwell/to stay/to reside/to stop/(suffix indicating firmness, steadiness, or coming to a halt)";"在 (exist; zài; hsk1)";"to exist; to be alive/(of sb or sth) to be (located) at/(used before a verb to indicate an action in progress)";"一个 (yīgè; non-hsk)";"No definition found";"高级 (high level; gāojí; hsk5|stront1)";"high level/high grade/advanced/high-ranking";"公寓 (apartment; gōngyù; hsk5|stront1|stront2)";"apartment building; block of flats (may be a public housing block or a condominium etc) (CL:套[tào])"
"昆虫的种类非常多。";"kūnchóng de zhǒnglèi fēicháng duō.";"There are many different types of insects.";"昆虫 (insect; kūnchóng; hsk5)";"insect/CL:只[zhī],群[qún],堆[duī]";"的 (of; de||dī||dí||dì; also pr. dì or di in poetry and songs; hsk1)";"of; ~'s (possessive particle); (used after an attribute); (used to form a nominal expression); (used at the end of a declarative sentence for emphasis); a cab (abbr. for 的士[dī shì])||really and truly||(bound form) bull's-eye; target";"种类 (category; zhǒnglèi; hsk5|stront1)";"kind/genus/type/category/variety/species/sort/class";"非常 (very; fēicháng; hsk2)";"very; really/unusual; extraordinary";"多 (many; duō; Taiwan pr. duó; hsk1)";"many; much/too many; poly-"
"这盏灯很亮。";"zhè zhǎndēng hěn liàng.";"This lamp is very bright.";"这 (this; zhè; commonly pr. zhèi esp. in Beijing; non-hsk)";"(pronoun) this; these/(bound form) this; the (followed by a noun)/(bound form) this";"盏灯 (zhǎndēng; non-hsk)";"No definition found";"很 (very; hěn; hsk1)";"(adverb of degree)/quite/very/awfully";"亮 (bright; liàng; hsk5|stront1)";"bright; light/to shine; to flash/loud and clear/to show (one's passport etc); to make public (one's views etc)"
"这个理由不够充分。";"zhège lǐyóu bùgòu chōngfèn.";"This reason is not sufficient enough.";"这个 (zhège; non-hsk)";"(pronoun) this/(adjective) this";"理由 (reason; lǐyóu; hsk5|stront2)";"reason/grounds/justification/CL:个[gè]";"不够 (insufficient; bùgòu; non-hsk)";"not enough/insufficient/inadequate";"充分 (ample; chōngfèn; hsk5)";"ample/sufficient/adequate/full/fully/to the full"
"分手是一种成熟的选择。";"fēnshǒu shì yīzhǒng chéngshú de xuǎnzé.";"Breaking up is a mature choice.";"分手 (break up; fēnshǒu; hsk5)";"to part company/to split up/to break up";"是 (to be; shì; hsk1)";"to be (followed by substantives only); correct; right; true; (respectful acknowledgement of a command) very well; (adverb for emphatic assertion)";"一种 (yīzhǒng; non-hsk)";"one kind of; one type of";"成熟 (mature; chéngshú; Taiwan pr. chéng shóu; hsk5|stront1)";"mature; ripe/to mature";"的 (of; de||dī||dí||dì; also pr. dì or di in poetry and songs; hsk1)";"of; ~'s (possessive particle); (used after an attribute); (used to form a nominal expression); (used at the end of a declarative sentence for emphasis); a cab (abbr. for 的士[dī shì])||really and truly||(bound form) bull's-eye; target";"选择 (select; xuǎnzé; hsk3|stront1)";"to select; to pick/choice; option; alternative"
"他们处理了这批受损的商品。";"tāmen chǔlǐ le zhèpī shòusǔn de shāngpǐn.";"They processed the damaged goods.";"他们 (they; tāmen; non-hsk)";"they; them";"处理 (handle; chǔlǐ; hsk5)";"to handle; to deal with/to punish/to treat sth by a special process; to process/to sell at reduced prices";"了 (finish; le||liǎo||liǎo; hsk1)";"(completed action marker); (modal particle indicating change of state, situation now); (modal particle intensifying preceding clause)||to finish; to achieve; variant of 了[liǎo]; to understand clearly||(of eyes) bright; clear-sighted; to understand clearly";"这批 (zhèpī; non-hsk)";"No definition found";"受损 (shòusǔn; non-hsk)";"to suffer damage";"的 (of; de||dī||dí||dì; also pr. dì or di in poetry and songs; hsk1)";"of; ~'s (possessive particle); (used after an attribute); (used to form a nominal expression); (used at the end of a declarative sentence for emphasis); a cab (abbr. for 的士[dī shì])||really and truly||(bound form) bull's-eye; target";"商品 (commodity; shāngpǐn; hsk5)";"commodity; goods; merchandise/CL:件[jiàn]"
"天气这么冷，何况还下雨。";"tiānqì zhème lěng, hékuàng hái xiàyǔ.";"The weather is so cold, besides it's raining.";"天气 (weather; tiānqì; hsk1|stront1)";"weather";"这么 (so much; zhème; non-hsk)";"so much/this much/how much?/this way/like this";"冷 (cold; lěng; hsk1)";"cold; surname Leng";"何况 (let alone; hékuàng; hsk5)";"let alone/to say nothing of/besides/what's more";"还 (still; huán||hái||huán; hsk2)";"still in progress; still more; yet; even more; in addition; fairly; passably (good); as early as; even; also; else||to pay back; to return; surname Huan||still";"下雨 (to rain; xiàyǔ; hsk1)";"to rain"
"她是一个善良的姑娘。";"tā shì yīgè shànliáng de gūniang.";"She is a kind young woman.";"她 (she; tā; hsk1)";"she";"是 (to be; shì; hsk1)";"to be (followed by substantives only); correct; right; true; (respectful acknowledgement of a command) very well; (adverb for emphatic assertion)";"一个 (yīgè; non-hsk)";"No definition found";"善良 (kindhearted; shànliáng; hsk5|stront1)";"good and honest/kindhearted";"的 (of; de||dī||dí||dì; also pr. dì or di in poetry and songs; hsk1)";"of; ~'s (possessive particle); (used after an attribute); (used to form a nominal expression); (used at the end of a declarative sentence for emphasis); a cab (abbr. for 的士[dī shì])||really and truly||(bound form) bull's-eye; target";"姑娘 (girl; gūniang; hsk5)";"girl/young woman/young lady/daughter/paternal aunt (old)/CL:个[gè]"
"我们见到了总理。";"wǒmen jiàndào le zǒnglǐ.";"We met the prime minister.";"我们 (we; wǒmen; hsk1)";"we; us; ourselves; our";"见到 (see; jiàndào; non-hsk)";"to see";"了 (finish; le||liǎo||liǎo; hsk1)";"(completed action marker); (modal particle indicating change of state, situation now); (modal particle intensifying preceding clause)||to finish; to achieve; variant of 了[liǎo]; to understand clearly||(of eyes) bright; clear-sighted; to understand clearly";"总理 (premier; zǒnglǐ; hsk5)";"premier/prime minister/CL:个[gè],位[wèi],名[míng]"
"气球慢慢升上天空。";"qìqiú mànmàn shēng shàng tiānkōng.";"The balloon slowly rose into the sky.";"气球 (balloon; qìqiú; non-hsk)";"balloon";"慢慢 (slowly; mànmàn; non-hsk)";"slowly";"升 (ascend; shēng; hsk5)";"to ascend; to rise to the rank of; to promote; to hoist; liter; measure for dry grain equal to one-tenth dou 斗[dǒu]";"上 (above; shǎng||shàng; hsk1)";"used in 上聲|上声[shǎng shēng]||(bound form) up; upper; above; previous; first (of multiple parts); to climb; to get onto; to go up; to attend (class or university); (directional complement) up; (noun suffix) on; above";"天空 (sky; tiānkōng; hsk5)";"sky"
"地震引起了强烈的振动。";"dìzhèn yǐnqǐ le qiángliè de zhèndòng.";"The earthquake caused strong vibrations.";"地震 (earthquake; dìzhèn; hsk5)";"earthquake";"引起 (give rise to; yǐnqǐ; hsk4)";"to give rise to; to lead to; to cause; to arouse";"了 (finish; le||liǎo||liǎo; hsk1)";"(completed action marker); (modal particle indicating change of state, situation now); (modal particle intensifying preceding clause)||to finish; to achieve; variant of 了[liǎo]; to understand clearly||(of eyes) bright; clear-sighted; to understand clearly";"强烈 (intense; qiángliè; hsk5)";"strong; intense";"的 (of; de||dī||dí||dì; also pr. dì or di in poetry and songs; hsk1)";"of; ~'s (possessive particle); (used after an attribute); (used to form a nominal expression); (used at the end of a declarative sentence for emphasis); a cab (abbr. for 的士[dī shì])||really and truly||(bound form) bull's-eye; target";"振动 (vibrate; zhèndòng; hsk5|stront2)";"to vibrate/to shake/vibration"
"这条路有点斜。";"zhètiáo lù yǒudiǎn xié.";"This road is a bit inclined.";"这条 (zhè tiáo; non-hsk)";"No definition found";"路 (road; lù; hsk2)";"road (CL:条[tiáo]); journey; route; line (bus etc); sort; kind; surname Lu";"有点 (yǒudiǎn; non-hsk)";"a little";"斜 (inclined; xié; hsk5)";"inclined/slanting/oblique/tilting"
"总算完成了这个项目。";"zǒngsuàn wánchéng le zhège xiàngmù.";"Finally, the project is completed.";"总算 (finally; zǒngsuàn; hsk5)";"at long last/finally/on the whole";"完成 (complete; wánchéng; hsk3)";"to complete; to accomplish";"了 (finish; le||liǎo||liǎo; hsk1)";"(completed action marker); (modal particle indicating change of state, situation now); (modal particle intensifying preceding clause)||to finish; to achieve; variant of 了[liǎo]; to understand clearly||(of eyes) bright; clear-sighted; to understand clearly";"这个 (zhège; non-hsk)";"(pronoun) this/(adjective) this";"项目 (project; xiàngmù; hsk5)";"item/project/(sports) event/CL:个[gè]"
"性情决定命运。";"xìngqíng juédìng mìngyùn.";"Temperament determines destiny.";"性情 (nature; xìngqíng; stront1)";"nature/temperament";"决定 (decide; juédìng; hsk3|stront1)";"to decide (to do something)/to resolve/decision/CL:个[gè],项[xiàng]/certainly";"命运 (fate; mìngyùn; hsk5)";"fate; destiny/CL:个[gè]"
"他拐弯的速度很快。";"tā guǎiwān de sùdù hěnkuài.";"He turns corners very quickly.";"他 (he; tā; hsk1)";"he; him (used for either sex when the sex is unknown or unimportant)/(used before sb's name for emphasis)/(used as a meaningless mock object)/(literary) other";"拐弯 (turn; guǎiwān; hsk5)";"to go round a curve/to turn a corner/fig. a new direction";"的 (of; de||dī||dí||dì; also pr. dì or di in poetry and songs; hsk1)";"of; ~'s (possessive particle); (used after an attribute); (used to form a nominal expression); (used at the end of a declarative sentence for emphasis); a cab (abbr. for 的士[dī shì])||really and truly||(bound form) bull's-eye; target";"速度 (speed; sùdù; hsk4|stront1)";"speed/rate/velocity/(music) tempo/CL:个[gè]";"很快 (hěnkuài; non-hsk)";"No definition found"
